Keyword,Intent,Volume,Keyword Difficulty,CPC (USD),Competitive Density,SERP Features
assistência técnica geladeira dako em natal rn,,0,,0.00,0.00,
assistência técnica geladeira dako presidente prudente,,0,,0.00,0.00,
assistência técnica geladeira dako registro-sp,,0,,0.00,0.00,
assistência técnica geladeira duplex eletrolux em campos dos goytacazes,,0,,0.00,0.00,
assistência técnica geladeira e fogão,,0,,0.00,0.00,
assistência técnica geladeira elber rs,,0,,0.00,0.00,
assistência técnica geladeira electorlux,,0,,0.00,0.00,
assistência técnica geladeira electrolux 24 horas,,0,,1.01,0.82,
assistência técnica geladeira electrolux alto maracanã,,0,,0.00,0.00,
assistência técnica geladeira electrolux avenida itavuvu sorocaba,,0,,0.00,0.00,
assistência técnica geladeira electrolux baixada fluminense,,0,,0.00,0.00,
assistência técnica geladeira electrolux barra da tijuca rj,,0,,0.00,0.00,
assistência técnica geladeira electrolux bh,,0,,1.77,0.92,
assistência técnica geladeira electrolux blumenau,,0,,0.00,0.00,
assistência técnica geladeira electrolux brasília df,,0,,0.00,0.00,
assistência técnica geladeira electrolux carapicuíba,,0,,0.00,0.00,
assistência técnica geladeira electrolux centro são paulo,,0,,0.00,0.00,
assistência técnica geladeira electrolux dc48,,0,,0.00,0.00,
assistência técnica geladeira electrolux df48,,0,,0.00,0.00,
assistência técnica geladeira electrolux df48 asa sul,,0,,0.00,0.00,
assistência técnica geladeira electrolux duque de caxias,,0,,0.00,0.00,
assistência técnica geladeira electrolux electrolux baixada fluminense,,0,,0.00,0.00,
assistência técnica geladeira electrolux em cidade aracy,,0,,0.00,0.00,
assistência técnica geladeira electrolux em diadema,,0,,0.00,0.00,
assistência técnica geladeira electrolux em itapevi,,0,,0.00,0.00,
assistência técnica geladeira electrolux em londrina,,0,,0.00,0.00,
assistência técnica geladeira electrolux em mogi das cruzes,,0,,0.00,0.00,
assistência técnica geladeira electrolux em rolim de moura,,0,,0.00,0.00,
assistência técnica geladeira electrolux em sorocaba,,0,,0.00,0.00,
assistência técnica geladeira electrolux florianopolis e regiao,,0,,0.00,0.00,
assistência técnica geladeira electrolux franca,,0,,0.00,0.00,
assistência técnica geladeira electrolux frost free df 38,,0,,0.00,0.00,
assistência técnica geladeira electrolux geladeira eletrolux zona norte,,0,,0.00,0.00,
assistência técnica geladeira electrolux goiania goiânia go,,0,,0.00,0.00,
assistência técnica geladeira electrolux goiânia,,0,,0.00,0.00,
assistência técnica geladeira electrolux goiânia goiás,,0,,0.00,0.00,
assistência técnica geladeira electrolux guarulhos,,0,,0.00,0.00,
assistência técnica geladeira electrolux ilheus,,0,,0.00,0.00,
assistência técnica geladeira electrolux jundiai-sp,,0,,0.00,0.00,
assistência técnica geladeira electrolux manaus,,0,,0.00,0.00,
assistência técnica geladeira electrolux nova iguaçu,,0,,0.00,0.00,
assistência técnica geladeira electrolux petrópolis rj,,0,,0.00,0.00,
assistência técnica geladeira electrolux porto alegre azenha,,0,,0.00,0.00,
assistência técnica geladeira electrolux recreio dos bandeirantes rj,,0,,0.00,0.00,
assistência técnica geladeira electrolux rio de janeiro rj,,0,,0.00,0.00,
assistência técnica geladeira electrolux rj,,0,,0.00,0.00,
assistência técnica geladeira electrolux salvador,,0,,0.00,0.00,
assistência técnica geladeira electrolux santo andré,,0,,0.00,0.00,
assistência técnica geladeira electrolux sao caetano,,0,,0.00,0.00,
assistência técnica geladeira electrolux saúde,,0,,0.00,0.00,
assistência técnica geladeira electrolux são bernardo,,0,,0.00,0.00,
assistência técnica geladeira electrolux são bernardo do campo,,0,,0.00,0.00,
assistência técnica geladeira electrolux são judas,,0,,0.00,0.00,
assistência técnica geladeira electrolux tatuapé,,0,,0.00,0.00,
assistência técnica geladeira electrolux tijuca,,0,,0.00,0.00,
assistência técnica geladeira electrolux trocar a borracha,,0,,0.00,0.00,
assistência técnica geladeira electrolux vila mariana,,0,,0.00,0.00,
assistência técnica geladeira eletrolux,,0,,0.74,0.76,
assistência técnica geladeira eletrolux alto maracanã,,0,,0.00,0.00,
assistência técnica geladeira eletrolux dc 49c,,0,,0.00,0.00,
assistência técnica geladeira eletrolux e frigidaire,,0,,0.00,0.00,
assistência técnica geladeira eletrolux em americana sp,,0,,0.00,0.00,
assistência técnica geladeira eletrolux ilhéus,,0,,0.00,0.00,
assistência técnica geladeira eletrolux indaiatuba,,0,,0.00,0.00,
assistência técnica geladeira eletrolux mooca,,0,,0.00,0.00,
assistência técnica geladeira eletrolux na região de santo amaro,,0,,0.00,0.00,
assistência técnica geladeira eletrolux palmas,,0,,0.00,0.00,
assistência técnica geladeira eletrolux são bernardo do campo,,0,,0.00,0.00,
assistência técnica geladeira eletrolux vila mariana,,0,,0.00,0.00,
assistência técnica geladeira em blumenau,,0,,0.00,0.00,
assistência técnica geladeira em brasília df,,0,,0.00,0.00,
assistência técnica geladeira em ermelino matarazzo,,0,,0.00,0.00,
assistência técnica geladeira em franca,,0,,0.00,0.00,
assistência técnica geladeira em itaquaquecetuba,,0,,0.00,0.00,
assistência técnica geladeira em jf,,0,,0.00,0.00,
assistência técnica geladeira em londrina,,0,,0.00,0.00,
assistência técnica geladeira em manhuaçu,,0,,0.00,0.00,
assistência técnica geladeira em nova contagem,,0,,0.00,0.00,
assistência técnica geladeira em paulínia,,0,,0.00,0.00,
assistência técnica geladeira em rolim de moura,,0,,0.00,0.00,
assistência técnica geladeira em sao bernardo do campo,,0,,0.00,0.00,
assistência técnica geladeira em suzano,,0,,0.00,0.00,
assistência técnica geladeira em são gonçalo,,0,,0.00,0.00,
assistência técnica geladeira em são joão clímaco,,0,,0.00,0.00,
assistência técnica geladeira em são roque,,0,,0.00,0.00,
assistência técnica geladeira em são vicente,,0,,0.00,0.00,
assistência técnica geladeira em são vicente-sp,,0,,0.00,0.00,
assistência técnica geladeira em uberlândia,,0,,0.00,0.00,
assistência técnica geladeira estancia velha,,0,,0.00,0.00,
assistência técnica geladeira feira de santana ba,,0,,0.00,0.00,
assistência técnica geladeira fortaleza,,0,,0.00,0.00,
assistência técnica geladeira frost free,,0,,0.00,0.00,
assistência técnica geladeira frost free electrolux,,0,,0.00,0.00,
assistência técnica geladeira frost free electrolux lauro de freitas,,0,,0.00,0.00,
assistência técnica geladeira g&e rj,,0,,0.00,0.00,
assistência técnica geladeira ge 24h cariacica,,0,,0.00,0.00,
assistência técnica geladeira ge 24h cariacica rio marinho,,0,,0.00,0.00,
assistência técnica geladeira ge aracaju,,0,,0.00,0.00,
assistência técnica geladeira ge belrm pará,,0,,0.00,0.00,
assistência técnica geladeira ge campinas,,0,,0.00,0.00,
assistência técnica geladeira ge campinas vila nova,,0,,0.00,0.00,
assistência técnica geladeira ge df,,0,,0.00,0.00,
assistência técnica geladeira ge em campinas,,0,,0.00,0.00,
assistência técnica geladeira ge em itaperuna,,0,,0.00,0.00,
assistência técnica geladeira ge em lagoa santa,,0,,0.00,0.00,
assistência técnica geladeira ge em ribeirão preto,,0,,0.00,0.00,
assistência técnica geladeira ge em rio preto,,0,,0.00,0.00,
assistência técnica geladeira ge em vitoria-es,,0,,0.00,0.00,
assistência técnica geladeira ge fortaleza,,0,,0.00,0.00,
assistência técnica geladeira ge frost free,,0,,0.00,0.00,
assistência técnica geladeira ge manaus,,0,,0.00,0.00,
assistência técnica geladeira ge maringá,,0,,0.00,0.00,
assistência técnica geladeira ge na praia grande,,0,,0.00,0.00,
assistência técnica geladeira ge no df,,0,,0.00,0.00,
assistência técnica geladeira ge pa,,0,,0.00,0.00,
assistência técnica geladeira ge ponta grossa,,0,,0.00,0.00,
assistência técnica geladeira ge porto alegre,,0,,0.00,0.00,
assistência técnica geladeira ge presidente prudente,,0,,0.00,0.00,
assistência técnica geladeira ge recife,,0,,0.00,0.00,
assistência técnica geladeira ge rj,,0,,0.00,0.00,
assistência técnica geladeira ge side by em manaus,,0,,0.00,0.00,
assistência técnica geladeira ge suzano,,0,,0.00,0.00,
assistência técnica geladeira ge uberlândia,,0,,0.00,0.00,
assistência técnica geladeira ge zona oeste,,0,,0.00,0.00,
assistência técnica geladeira geem recife,,0,,0.00,0.00,
assistência técnica geladeira gelopar,,0,,0.00,0.00,
assistência técnica geladeira general electric,,0,,0.00,0.00,
assistência técnica geladeira general eletric,,0,,0.00,0.00,
assistência técnica geladeira general eletric em são paulo,,0,,0.00,0.00,
assistência técnica geladeira general eletric rj,,0,,0.00,0.00,
assistência técnica geladeira goiânia,,0,,0.00,0.00,
assistência técnica geladeira ibbl ponta grossa,,0,,0.00,0.00,
assistência técnica geladeira imirim,,0,,0.00,0.00,
assistência técnica geladeira indaiatuba,,0,,0.00,0.00,
assistência técnica geladeira inox philips,,0,,0.00,0.00,
assistência técnica geladeira inverse itapevi,,0,,0.00,0.00,
assistência técnica geladeira itaim paulista,,0,,0.00,0.00,
assistência técnica geladeira itapecerrica fa serra,,0,,0.00,0.00,
assistência técnica geladeira jf,,0,,0.00,0.00,
assistência técnica geladeira juiz de fora,,0,,0.00,0.00,
assistência técnica geladeira lectrolux centro são paulo,,0,,0.00,0.00,
assistência técnica geladeira lg barra da tijuca rj,,0,,0.00,0.00,
assistência técnica geladeira lg campinas,,0,,0.00,0.00,
assistência técnica geladeira lg curicica rj,,0,,0.00,0.00,
assistência técnica geladeira lg em campos dos goytacazes,,0,,0.00,0.00,
assistência técnica geladeira lg em itaquaquecetuba,,0,,0.00,0.00,
assistência técnica geladeira lg manaus,,0,,0.00,0.00,
assistência técnica geladeira lg recreio dos bandeirantes rj,,0,,0.00,0.00,
assistência técnica geladeira lg rio de janeiro rj,,0,,0.00,0.00,
assistência técnica geladeira lg rj,,0,,0.00,0.00,
assistência técnica geladeira lg side,,0,,0.00,0.00,
assistência técnica geladeira limeira,,0,,0.00,0.00,
assistência técnica geladeira londrina,,0,,0.00,0.00,
assistência técnica geladeira luís eduardo magalhães,,0,,0.00,0.00,
assistência técnica geladeira mabe,,0,,0.00,0.00,
assistência técnica geladeira mabe rj,,0,,0.00,0.00,
assistência técnica geladeira mabe washington luiz sp,,0,,0.00,0.00,
assistência técnica geladeira massaguaçú,,0,,0.00,0.00,
assistência técnica geladeira maxiclima,,0,,0.00,0.00,
assistência técnica geladeira metal frio,,0,,0.00,0.00,
assistência técnica geladeira metalfrio,,0,,0.00,0.00,
assistência técnica geladeira metalfrio ribeirão preto,,0,,0.00,0.00,
assistência técnica geladeira mob,,0,,0.00,0.00,
assistência técnica geladeira mooca,,0,,0.00,0.00,
assistência técnica geladeira multilaser,,0,,0.00,0.00,
assistência técnica geladeira na av alberto sarmento,,0,,0.00,0.00,
assistência técnica geladeira na av bento gonçalves porto alegre,,0,,0.00,0.00,
assistência técnica geladeira na suacuna ouro verde,,0,,0.00,0.00,
assistência técnica geladeira na tijuca rj,,0,,0.00,0.00,
assistência técnica geladeira na zona centro,,0,,0.00,0.00,
assistência técnica geladeira na zona leste,,0,,0.00,0.00,
assistência técnica geladeira no heliopolis,,0,,0.00,0.00,
assistência técnica geladeira no jd tupã barueri,,0,,0.00,0.00,
assistência técnica geladeira nova carpina,,0,,0.00,0.00,
assistência técnica geladeira nova iguaçu,,0,,0.00,0.00,
assistência técnica geladeira orcamento gratis av nonoai porto alegre,,0,,0.00,0.00,
assistência técnica geladeira osasco,,0,,0.00,0.00,
assistência técnica geladeira osasco emergência,,0,,0.00,0.00,
assistência técnica geladeira panasonic araraquara,,0,,0.00,0.00,
assistência técnica geladeira panasonic campo grande ms,,0,,0.00,0.00,
assistência técnica geladeira panasonic em marília,,0,,0.00,0.00,
assistência técnica geladeira panasonic em são pedro da aldeia,,0,,0.00,0.00,
assistência técnica geladeira panasonic es,,0,,0.00,0.00,
assistência técnica geladeira panasonic feiratec,,0,,0.00,0.00,
assistência técnica geladeira panasonic feiratech,,0,,0.00,0.00,
assistência técnica geladeira panasonic inverter em manaus,,0,,0.00,0.00,
assistência técnica geladeira panasonic macapá,,0,,0.00,0.00,
assistência técnica geladeira panasonic manaus,,0,,0.00,0.00,
assistência técnica geladeira panasonic montes claros,,0,,0.00,0.00,
assistência técnica geladeira panasonic niterói,,0,,0.00,0.00,
assistência técnica geladeira panasonic pernambu6,,0,,0.00,0.00,
assistência técnica geladeira panda,,0,,0.00,0.00,
assistência técnica geladeira paranagua,,0,,0.00,0.00,
assistência técnica geladeira perdizes,,0,,0.00,0.00,
assistência técnica geladeira petrolina,,0,,0.00,0.00,
assistência técnica geladeira philco,,0,,0.00,0.00,
assistência técnica geladeira pinheiros,,0,,0.00,0.00,
assistência técnica geladeira piracicaba,,0,,0.00,0.00,
assistência técnica geladeira piraja,,0,,0.00,0.00,
assistência técnica geladeira pirituba,,0,,0.00,0.00,
assistência técnica geladeira porto alegre,,0,,0.00,0.00,
assistência técnica geladeira portátil,,0,,0.00,0.00,
assistência técnica geladeira poá sp,,0,,0.00,0.00,
assistência técnica geladeira praia grande,,0,,0.00,0.00,
assistência técnica geladeira próximo a mim,,0,,0.00,0.00,
assistência técnica geladeira resfriar de cabine,,0,,0.00,0.00,
assistência técnica geladeira riacho,,0,,0.00,0.00,
assistência técnica geladeira ribeirão verde,,0,,0.00,0.00,
assistência técnica geladeira rio de janeiro,,0,,0.00,0.71,
assistência técnica geladeira rio grande,,0,,0.00,0.00,
assistência técnica geladeira rua ademar martins de freitas,,0,,0.00,0.00,
assistência técnica geladeira rua durval fernandes chaves,,0,,0.00,0.00,
assistência técnica geladeira rua fanfula,,0,,0.00,0.00,
assistência técnica geladeira rua meriante,,0,,0.00,0.00,
assistência técnica geladeira salto,,0,,0.00,0.00,
assistência técnica geladeira samsung em franco da rocha,,0,,0.00,0.00,
assistência técnica geladeira samsung em niterói,,0,,0.00,0.00,
assistência técnica geladeira samsung em santos,,0,,0.00,0.00,
assistência técnica geladeira samsung em santos av bernardino de campos,,0,,0.00,0.00,
assistência técnica geladeira samsung em são paulo,,0,,0.00,0.00,
assistência técnica geladeira samsung freguesia do ó,,0,,0.00,0.00,
assistência técnica geladeira samsung itajai,,0,,0.00,0.00,
assistência técnica geladeira samsung juiz de fora,,0,,0.00,0.00,
assistência técnica geladeira samsung porto alegre,,0,,0.00,0.00,
assistência técnica geladeira samsung que em bh,,0,,0.00,0.00,
assistência técnica geladeira samsung rj,,0,,0.00,0.00,
assistência técnica geladeira samsung side by side freguesia do ó,,0,,0.00,0.00,
assistência técnica geladeira samsung sorocaba,,0,,0.00,0.00,
assistência técnica geladeira samsung vitória,,0,,0.00,0.00,
assistência técnica geladeira sanssung,,0,,0.00,0.00,
assistência técnica geladeira santana sp,,0,,0.00,0.00,
assistência técnica geladeira santarem,,0,,0.00,0.00,
assistência técnica geladeira santo andré,,0,,0.00,0.00,
assistência técnica geladeira santos,,0,,0.00,0.00,
assistência técnica geladeira sapucaia do sul,,0,,0.00,0.00,
assistência técnica geladeira sbc,,0,,0.00,0.00,
assistência técnica geladeira side by side ge,,0,,0.00,0.00,
assistência técnica geladeira side by side samsung freguesia do ó,,0,,0.00,0.00,
assistência técnica geladeira sidebayside foltro prome,,0,,0.00,0.00,
assistência técnica geladeira sion,,0,,0.00,0.00,
assistência técnica geladeira sorocaba,,0,,0.00,0.00,
assistência técnica geladeira sp paraiso,,0,,0.00,0.00,
assistência técnica geladeira são carlos,,0,,0.00,0.00,
assistência técnica geladeira são paulo,,0,,0.00,0.00,
assistência técnica geladeira taboão da serra,,0,,0.00,0.00,
assistência técnica geladeira tatuapé,,0,,0.00,0.00,
assistência técnica geladeira taubate,,0,,0.00,0.00,
assistência técnica geladeira taubaté,,0,,0.00,0.00,
assistência técnica geladeira tijuca,,0,,0.00,0.00,
assistência técnica geladeira uberlândia,,0,,0.00,0.00,
assistência técnica geladeira valinhos,,0,,0.00,0.00,
assistência técnica geladeira varginha,,0,,0.00,0.00,
assistência técnica geladeira veneza ipatinga,,0,,0.00,0.00,
assistência técnica geladeira viamao,,0,,0.00,0.00,
assistência técnica geladeira vila prudente,,0,,0.00,0.00,
assistência técnica geladeira visconde do rio branco itatiaia,,0,,0.00,0.00,
assistência técnica geladeira viçosa tatiaia,,0,,0.00,0.00,
assistência técnica geladeira zona leste,,0,,0.00,0.00,
assistência técnica geladeira zona norte sp,,0,,0.00,0.00,
assistência técnica geladeira élber colinas do tocantins,,0,,0.00,0.00,
assistência técnica geladeiras - elber,,0,,0.00,0.00,
assistência técnica geladeiras augusto franco,,0,,0.00,0.00,
assistência técnica geladeiras bairro gavea 2,,0,,0.00,0.00,
assistência técnica geladeiras bosch,,0,,0.00,0.00,
assistência técnica geladeiras bosch sorocaba,,0,,0.00,0.00,
assistência técnica geladeiras campo grande,,0,,0.00,0.00,
assistência técnica geladeiras conj augusto franco,,0,,0.00,0.00,
assistência técnica geladeiras consul canoas,,0,,0.00,0.00,
assistência técnica geladeiras continental em são josé dos campos,,0,,0.00,0.00,
assistência técnica geladeiras cuiabá,,0,,0.00,0.00,
assistência técnica geladeiras dako em viamão,,0,,0.00,0.00,
assistência técnica geladeiras e maquinas de lavar roupas,,0,,0.00,0.00,
assistência técnica geladeiras elber,,0,,0.44,0.68,
assistência técnica geladeiras electrolux,,0,,0.00,0.00,
assistência técnica geladeiras electrolux compensa manaus,,0,,0.00,0.00,
assistência técnica geladeiras electrolux gr em ribeirão preto,,0,,0.00,0.00,
assistência técnica geladeiras eletrolux,,0,,0.00,0.00,
assistência técnica geladeiras em caraguatatuba,,0,,0.00,0.00,
assistência técnica geladeiras em manaus,,0,,0.00,0.00,
assistência técnica geladeiras em ribeirão preto,,0,,0.00,0.00,
assistência técnica geladeiras em vespasiano,,0,,0.00,0.00,
assistência técnica geladeiras empalmas to,,0,,0.00,0.00,
assistência técnica geladeiras industriais,,0,,0.00,0.00,
assistência técnica geladeiras industriais em goiânia,,0,,0.00,0.00,
assistência técnica geladeiras inova bhz,,0,,0.00,0.00,
assistência técnica geladeiras na ilha do governador rj,,0,,0.00,0.00,
assistência técnica geladeiras na vila sônia,,0,,0.00,0.00,
assistência técnica geladeiras philips,,0,,0.00,0.00,
assistência técnica geladeiras pindamonhangaba,,0,,0.00,0.00,
assistência técnica geladeiras ponte preta campinas,,0,,0.00,0.00,
assistência técnica geladeiras samsung poa,,0,,0.00,0.00,
assistência técnica geladeiras sorocaba,,0,,0.00,0.00,
assistência técnica geladeiras taboão da serra,,0,,0.00,0.00,
assistência técnica geladeiras vespasiano,,0,,0.00,0.00,
assistência técnica geladeiras vitória - es,,0,,0.00,0.00,
assistência técnica geladeiras élber colinas do tocantins,,0,,0.00,0.00,
assistência técnica geomak geladeira em cruz alta rs,,0,,0.00,0.00,
assistência técnica ima de geladeira,,0,,0.00,0.00,
assistência técnica instalação de geladeira duplex electrolux rj,,0,,0.00,0.00,
assistência técnica instalação de geladeira duplex lg rj,,0,,0.00,0.00,
assistência técnica instalação de geladeira electrolux barra da tijuca rj,,0,,0.00,0.00,
assistência técnica instalação de geladeira electrolux rj,,0,,0.00,0.00,
assistência técnica instalação de geladeira french door electrolux rj,,0,,0.00,0.00,
assistência técnica instalação de geladeira french door samsung rj,,0,,0.00,0.00,
assistência técnica instalação de geladeira lg barra da tijuca rj,,0,,0.00,0.00,
assistência técnica instalação de geladeira lg recreio dos bandeirantes rj,,0,,0.00,0.00,
assistência técnica instalação de geladeira lg rio de janeiro rj,,0,,0.00,0.00,
assistência técnica instalação de geladeira lg rj,,0,,0.00,0.00,
assistência técnica instalação de geladeira samsung barra da tijuca rj,,0,,0.00,0.00,
assistência técnica instalação de geladeira samsung rio de janeiro rj,,0,,0.00,0.00,
assistência técnica instalação de geladeira samsung rj,,0,,0.00,0.00,
assistência técnica instalação de geladeira side by side electrolux rj,,0,,0.00,0.00,
assistência técnica instalação de geladeira side by side lg rj,,0,,0.00,0.00,
assistência técnica intaim paulista de geladeira eletrolux,,0,,0.00,0.00,
assistência técnica lava de roupas geladeira em sorocaba e região,,0,,0.00,0.00,
assistência técnica lg geladeira,,0,,0.88,0.88,
assistência técnica lg geladeira maringá,,0,,0.00,0.00,
assistência técnica lg geladeira rj,,0,,0.00,0.00,
assistência técnica lg geladeira side by side,,0,,0.00,0.00,
assistência técnica lg para geladeiras rj,,0,,0.00,0.00,
assistência técnica lâmpadas btr de geladeira eletrolux em maringa,,0,,0.00,0.00,
assistência técnica maquina de lavar e geladeira zona norte,,0,,0.00,0.00,
assistência técnica metalfrio geladeira,,0,,0.00,0.00,
assistência técnica micro-ondas geladeira rua são geraldo juiz de fora,,0,,0.00,0.00,
assistência técnica máquina de lavar e geladeira,,0,,0.00,0.00,
assistência técnica máquina de lavar e geladeira rua ataliba vieira,,0,,0.00,0.00,
assistência técnica máquina de lavar e geladeiras sorocaba,,0,,0.00,0.00,
assistência técnica p geladeira boch,,0,,0.00,0.00,
assistência técnica p geladeira bosch,,0,,0.00,0.00,
assistência técnica p geladeira bosch em campo largo,,0,,0.00,0.00,
assistência técnica p geladeira em rib preto,,0,,0.00,0.00,
assistência técnica panasonic geladeira cuiabá,,0,,0.00,0.00,
assistência técnica panasonic geladeira igrejinha,,0,,0.00,0.00,
assistência técnica panasonic geladeira macapá,,0,,0.00,0.00,
assistência técnica panasonic sp geladeira,,0,,0.00,0.00,
assistência técnica para conserto de geladeira na zona leste sp,,0,,0.00,0.00,
assistência técnica para equipamentos de geladeiras industriais em florianópolis,,0,,0.00,0.00,
assistência técnica para geladeira borracha porta,,0,,0.00,0.00,
assistência técnica para geladeira bosch,,0,,0.00,0.00,
assistência técnica para geladeira bosch kdv47,,0,,0.00,0.00,
assistência técnica para geladeira bosch perto de onde estou,,0,,0.00,0.00,
assistência técnica para geladeira brastemp em nilópolis,,0,,0.00,0.00,
assistência técnica para geladeira brastemp em recife,,0,,0.00,0.00,
assistência técnica para geladeira brastemp em recife caxangá,,0,,0.00,0.00,
assistência técnica para geladeira consul borracha porta,,0,,0.00,0.00,
assistência técnica para geladeira consul diadema,,0,,0.00,0.00,
assistência técnica para geladeira consul em guaratinguetá,,0,,0.00,0.00,
assistência técnica para geladeira consul em joinville,,0,,0.00,0.00,
assistência técnica para geladeira consul em recife,,0,,0.00,0.00,
assistência técnica para geladeira consul zona leste,,0,,0.00,0.00,
assistência técnica para geladeira curitiba,,0,,0.00,0.00,
assistência técnica para geladeira da samsung e fácil,,0,,0.00,0.00,
assistência técnica para geladeira de caminhão em são paulo,,0,,0.00,0.00,
assistência técnica para geladeira electrolux em poa,,0,,0.00,0.00,
assistência técnica para geladeira electrolux em poa sp,,0,,0.00,0.00,
assistência técnica para geladeira electrolux em recife caxangá,,0,,0.00,0.00,
assistência técnica para geladeira electrolux no alto tiete,,0,,0.00,0.00,
assistência técnica para geladeira em barueri,,0,,0.00,0.00,
assistência técnica para geladeira em caieiras,,0,,0.00,0.00,
assistência técnica para geladeira em catanduva,,0,,0.00,0.00,
assistência técnica para geladeira em gravatá,,0,,0.00,0.00,
assistência técnica para geladeira em picos,,0,,0.00,0.00,
assistência técnica para geladeira em picos pi,,0,,0.00,0.00,
assistência técnica para geladeira em salvador,,0,,0.00,0.00,
assistência técnica para geladeira em são joãodaboavista-sp,,0,,0.00,0.00,
assistência técnica para geladeira em vila galvão guarulhos,,0,,0.00,0.00,
assistência técnica para geladeira ge,,0,,0.00,0.00,
assistência técnica para geladeira ge no sacomã,,0,,0.00,0.00,
assistência técnica para geladeira na rua caiaponia bonsucesso bh,,0,,0.00,0.00,
assistência técnica para geladeira no bairro do cangaíba,,0,,0.00,0.00,
assistência técnica para geladeira no jaçanã são paulo,,0,,0.00,0.00,
assistência técnica para geladeira panasonic na cidade de araçatuba,,0,,0.00,0.00,
assistência técnica para geladeira próximo avenida itaquera,,0,,0.00,0.00,
assistência técnica para geladeira rua cananeia,,0,,0.00,0.00,
assistência técnica para geladeira samsung,,0,,0.00,0.00,
assistência técnica para geladeira zona leste,,0,,0.00,0.00,
assistência técnica para geladeiras abranches,,0,,0.00,0.00,
assistência técnica para geladeiras afonso pena,,0,,0.00,0.00,
assistência técnica para geladeiras ahú,,0,,0.00,0.00,
assistência técnica para geladeiras alto boqueirão,,0,,0.00,0.00,
assistência técnica para geladeiras alto da glória,,0,,0.00,0.00,
assistência técnica para geladeiras alto da xv,,0,,0.00,0.00,
assistência técnica para geladeiras araucária,,0,,0.00,0.00,
assistência técnica para geladeiras augusta,,0,,0.00,0.00,
assistência técnica para geladeiras bacacheri,,0,,0.00,0.00,
assistência técnica para geladeiras batel,,0,,0.00,0.00,
assistência técnica para geladeiras bigorrilho,,0,,0.00,0.00,
assistência técnica para geladeiras boa vista,,0,,0.00,0.00,
assistência técnica para geladeiras campina do siqueira,,0,,0.00,0.00,
assistência técnica para geladeiras campo comprido,,0,,0.00,0.00,
