Keyword,Intent,Volume,Keyword Difficulty,CPC (USD),Competitive Density,SERP Features
assistência técnica para geladeiras campo de santana,,0,,0.00,0.00,
assistência técnica para geladeiras capão da imbuia,,0,,0.00,0.00,
assistência técnica para geladeiras capão raso,,0,,0.00,0.00,
assistência técnica para geladeiras centro histórico,,0,,0.00,0.00,
assistência técnica para geladeiras cidade industrial,,0,,0.00,0.00,
assistência técnica para geladeiras continental,,0,,0.00,0.00,
assistência técnica para geladeiras curitiba,,0,,0.00,0.00,
assistência técnica para geladeiras e refrigeradores em jardim das oliveiras,,0,,0.00,0.00,
assistência técnica para geladeiras e refrigeradores em jardim das oliveiraszl,,0,,0.00,0.00,
assistência técnica para geladeiras e refrigeradores na zona leste,,0,,0.00,0.00,
assistência técnica para geladeiras eletrolux,,0,,0.00,0.00,
assistência técnica para geladeiras em estrela,,0,,0.00,0.00,
assistência técnica para geladeiras guabirotuba,,0,,0.00,0.00,
assistência técnica para geladeiras hauer,,0,,0.00,0.00,
assistência técnica para geladeiras jardim botânico,,0,,0.00,0.00,
assistência técnica para geladeiras jardim social,,0,,0.00,0.00,
assistência técnica para geladeiras mercês,,0,,0.00,0.00,
assistência técnica para geladeiras no df,,0,,0.00,0.00,
assistência técnica para geladeiras no nucleo bandeirante,,0,,0.00,0.00,
assistência técnica para geladeiras pilarzinho,,0,,0.00,0.00,
assistência técnica para geladeiras pinheirinho,,0,,0.00,0.00,
assistência técnica para geladeiras portão,,0,,0.00,0.00,
assistência técnica para geladeiras rebouças,,0,,0.00,0.00,
assistência técnica para geladeiras riviera,,0,,0.00,0.00,
assistência técnica para geladeiras santa quitéria,,0,,0.00,0.00,
assistência técnica para geladeiras santo inácio,,0,,0.00,0.00,
assistência técnica para geladeiras seminário,,0,,0.00,0.00,
assistência técnica para geladeiras são braz,,0,,0.00,0.00,
assistência técnica para geladeiras três marias,,0,,0.00,0.00,
assistência técnica para geladeiras umbará,,0,,0.00,0.00,
assistência técnica para geladeiras vila izabel,,0,,0.00,0.00,
assistência técnica para geladeiras vista alegre,,0,,0.00,0.00,
assistência técnica para geladeiras xaxim,,0,,0.00,0.00,
assistência técnica para geladeiras águas belas,,0,,0.00,0.00,
assistência técnica para peças geladeira ge,,0,,0.00,0.00,
assistência técnica permanente geladeira 12v,,0,,0.00,0.00,
assistência técnica pra geladeira em divinópolis,,0,,0.00,0.00,
assistência técnica que alyga geladeiras em joao pessoa,,0,,0.00,0.00,
assistência técnica recol geladeira em cruz alta rs,,0,,0.00,0.00,
assistência técnica refrigeração em geladeira electrolux em poá sp,,0,,0.00,0.00,
assistência técnica refrigeração geladeira,,0,,0.00,0.00,
assistência técnica refrigeração geladeira botucatu,,0,,0.00,0.00,
assistência técnica sabra refrigeração de geladeira em são paulo endereço,,0,,0.00,0.00,
assistência técnica sabria refrigeração consertos de geladeira em são paulo,,0,,0.00,0.00,
assistência técnica samsung geladeira niterói,,0,,0.00,0.00,
assistência técnica samsung geladeira salto,,0,,0.00,0.00,
assistência técnica samsung geladeiras,,0,,0.00,0.00,
assistência técnica samsung geladeiras é boa,,0,,0.00,0.00,
assistência técnica samsung manaus geladeira,,0,,0.00,0.00,
assistência técnica samsung para geladeira em maceió,,0,,0.00,0.00,
assistência técnica samsung salvador geladeira,,0,,0.00,0.00,
assistência técnica sansung geladeira,,0,,0.00,0.00,
assistência técnica técnica de geladeira,,0,,0.00,0.00,
assistência técnica técnica electrolux para geladeiras,,0,,0.00,0.00,
assistência técnica venancio geladeira,,0,,0.00,0.00,
assistência técnica vila sabrina geladeira,,0,,0.00,0.00,
assistência técnica vila sabrina geladeira dedé,,0,,0.00,0.00,
assistência técnico geladeiro consul belo horizonte,,0,,0.00,0.00,
assistências técnicas para geladeira duplex,,0,,0.00,0.00,
assistências técnicas para geladeira e freezer,,0,,0.00,0.00,
assistências técnicas para geladeira e freezer bosch,,0,,0.00,0.00,
assistências técnicas para geladeira e freezer brastemp,,0,,0.00,0.00,
assistências técnicas para geladeira e freezer brastemp em curitiba,,0,,0.00,0.00,
assistências técnicas para geladeira e freezer consul,,0,,0.00,0.00,
assistências técnicas para geladeira e freezer dako,,0,,0.00,0.00,
assistências técnicas para geladeira e freezer dako em curitiba,,0,,0.00,0.00,
assistências técnicas para geladeira e freezer electrolux,,0,,0.00,0.00,
assistências técnicas para geladeira e freezer ge,,0,,0.00,0.00,
assistências técnicas para geladeira e freezer lg,,0,,0.00,0.00,
assistências técnicas para geladeira e freezer samsung,,0,,0.00,0.00,
atl assistência técnica de geladeira cachoeirinha rs,,0,,0.00,0.00,
aturine assistência técnica geladeira,,0,,0.00,0.00,
aturine assistência técnica geladeira são cristovao,,0,,0.00,0.00,
autorizada da assistência técnica da electrolux geladeira duplex em campos,,0,,0.00,0.00,
av sao sebastiao surubim pe assistência técnica de geladeira m,,0,,0.00,0.00,
avaliação melhores geladeiras assistência técnica,,0,,0.00,0.00,
banner de assistência técnica geladeira,,0,,0.00,0.00,
barra de maxaranguape assistência técnica geladeira,,0,,0.00,0.00,
barra de maxaranguape rn assistência técnica geladeira,,0,,0.00,0.00,
beija flor assistência técnica geladeira,,0,,0.00,0.00,
bosch geladeira assistência técnica,,0,,0.67,0.62,
brastem geladeira assistência técnica teresina pi,,0,,0.00,0.00,
brastemp assistência técnica geladeiras,,0,,0.00,0.00,
brastemp assistência técnica rio de janeiro geladeira,,0,,0.00,0.00,
brastemp geladeira assistência técnica cariacica es,,0,,0.00,0.00,
brastemp geladeira assistência técnica rj,,0,,0.00,0.00,
brastemp geladeira assistência técnica vila velha es,,0,,0.00,0.00,
casa das geladeiras aastep assistência técnica,,0,,0.00,0.33,
casa das geladeiras aastep assistência técnica são paulo sp,,0,,0.00,0.00,
casa das geladeiras-aastep assistência técnica,,0,,0.00,0.00,
casa das geladeiras-aastep assistência técnica sp,,0,,0.00,0.00,
casa das geladeiras-aastep assistência técnica são paulo - sp,,0,,0.00,0.00,
celebra assistência técnica geladeira,,0,,0.00,0.00,
conserto assistência técnica geladeiras,,0,,0.00,0.00,
conserto de geladeira flamengo rj assistência técnica brastemp,,0,,0.00,0.00,
conserto de geladeira rj assistência técnica mesquita rj,,0,,0.00,0.00,
conserto geladeira barreiro assistência técnica belo horizonte - mg,,0,,0.00,0.00,
conserto geladeira bh rapidão assistência técnica belo horizonte - mg,,0,,0.00,0.00,
consertogelasp - assistência técnica geladeira sp são paulo - sp,,0,,0.00,0.00,
consul assistência técnica geladeira porto alegre,,0,,0.00,0.00,
consumidor tem obrigação de levar geladeira a assistência técnica,,0,,0.00,0.00,
continental geladeiras assistência técnica,,0,,0.00,0.00,
diadema assistência técnica geladeira brastemp,,0,,0.00,0.00,
elber geladeiras assistência técnica,,0,,0.00,0.39,
electrolux geladeira assistência técnica araraquara sp,,0,,0.00,0.00,
electrolux geladeira assistência técnica congonhas,,0,,0.00,0.00,
electrolux geladeira assistência técnica em salvador,,0,,0.00,0.00,
electrolux geladeira assistência técnica fortaleza,,0,,0.00,0.00,
electrolux geladeira assistência técnica franca sp,,0,,0.00,0.00,
eletro xandy assistência técnica de geladeira e maquina de lavar,,0,,0.00,0.00,
eletrogelar assistência técnica - conserto de lavadora e geladeira,,0,,0.00,0.00,
eletrolinch assistência técnica máquinas de lavar e geladeira,,0,,0.00,0.02,
eletrolux a geladeira frost free assistência técnica,,0,,0.00,0.00,
eletrolux assistência técnica geladeira mooca,,0,,0.00,0.00,
eletrolux geladeira assistência técnica em mauá são paulo,,0,,0.00,0.00,
eletrolux geladeira assistência técnica em uberlandia minas gerais,,0,,0.00,0.00,
eletrolux geladeira assistência técnica joão pessoa,,0,,0.00,0.00,
em salvador assistência técnica de geladeira brastempe,,0,,0.00,0.00,
enquanto geladeira está na assistência técnica,,0,,0.00,0.00,
fone assistência técnica samsung geladeira,,0,,0.00,0.00,
foto de cartao assistência técnica para lavadora e geladeira,,0,,0.00,0.00,
função da linguagem kuka fresca assistência técnica de geladeiras,,0,,0.00,0.00,
garantia de conserto assistência técnica geladeira,,0,,0.00,0.00,
ge geladeiras máquinas lavar fogões assistência técnica,,0,,0.00,0.00,
ge geladeiras máquinas lavar fogões assistência técnica são paulo sp,,0,,0.00,0.00,
geladeira assistência técnica 24 horas,,0,,0.00,0.00,
geladeira assistência técnica angra dos reis,,0,,0.00,0.00,
geladeira assistência técnica bandeirante cariacica es,,0,,0.00,0.00,
geladeira assistência técnica bela aurora cariacica es,,0,,0.00,0.00,
geladeira assistência técnica cariacica es,,0,,0.00,0.00,
geladeira assistência técnica cobilandia es,,0,,0.00,0.00,
geladeira assistência técnica consertos,,0,,0.00,0.00,
geladeira assistência técnica em uberlandia minas gerais,,0,,0.00,0.00,
geladeira assistência técnica na dois de julho salvador,,0,,0.00,0.00,
geladeira assistência técnica vila velha,,0,,0.00,0.00,
geladeira bosch assistência técnica,,0,,0.67,0.62,
geladeira bosch assistência técnica londrina,,0,,0.00,0.00,
geladeira bosch assistência técnica pernambuco,,0,,0.00,0.00,
geladeira bosch ecoplus 315 assistência técnica,,0,,0.00,0.00,
geladeira bosch frost free assistência técnica em mogi guaçu,,0,,0.00,0.00,
geladeira brastemp assistência técnica autorizada,,0,,0.00,0.00,
geladeira brastemp assistência técnica em barueri,,0,,0.00,0.00,
geladeira brastemp assistência técnica em paulínia sp,,0,,0.00,0.00,
geladeira brastemp assistência técnica em valinhos sp,,0,,0.00,0.00,
geladeira brastemp assistência técnica rio de janeiro,,0,,0.00,0.00,
geladeira brastemp assistência técnica santa cruz do sul,,0,,0.00,0.00,
geladeira brastemp brm45hb assistência técnica,,0,,0.00,0.00,
geladeira brastemp center assistência técnica em valinhos sp,,0,,0.00,0.00,
geladeira consul assistência técnica em ilhéus,,0,,0.00,0.00,
geladeira continental assistência técnica brasília,,0,,0.00,0.00,
geladeira electrolux assistência técnica em ananindeua,,0,,0.00,0.00,
geladeira electrolux assistência técnica são mateus,,0,,0.00,0.00,
geladeira electrolux df35 assistência técnica,,0,,0.00,0.00,
geladeira ge frost free 410 assistência técnica,,0,,0.00,0.00,
geladeira ge profile arctica assistência técnica,,0,,0.00,0.00,
geladeira lg 480 l assistência técnica,,0,,0.00,0.00,
geladeira panasonic em feira de santana assistência técnica,,0,,0.00,0.00,
geladeira panasonic preta inverse assistência técnica,,0,,0.00,0.00,
geladeira portatil 12v black decker bdc204-la assistência técnica,,0,,0.00,0.00,
geladeira sansung assistência técnica,,0,,0.00,0.00,
geladeira tecnico ou assistência técnica,,0,,0.00,0.00,
geladeiras assistência técnica são josé dos campos,,0,,0.00,0.00,
geladeiras com assistência técnica mais baratas,,0,,0.00,0.00,
geladeiras ge assistência técnica,,0,,0.00,0.00,
geladeiras samsung em setelagoas assistência técnica,,0,,0.00,0.00,
general electric geladeira assistência técnica,,0,,0.00,0.00,
gicelmo assistência técnica geladeiras conj augusto franco,,0,,0.00,0.00,
gj assistência técnica conserto de geladeira maquina de lavar olinda,,0,,0.00,0.00,
harley assistência técnica de geladeiras,,0,,0.00,0.00,
helice geladeira electrolux frost free df37 preço assistência técnica,,0,,0.00,0.00,
horus assistência técnica de geladeira em itapecerica da serra,,0,,0.00,0.00,
iceblue refrigeração-conserto de geladeira assistência técnica,,0,,0.00,0.00,
icemaq assistência técnica- geladeira/ máquina de lavar roupa/ secadora,,0,,0.00,0.00,
ima de geladeira assistência técnica,,0,,0.00,0.00,
imagem assistência técnica de geladeira e máquina de lavar,,0,,0.00,0.00,
imagens de assistência técnica de geladeira e máquina de lavar,,0,,0.00,0.00,
j tec assistência técnica geladeiras lavadoras e lave e seca,,0,,0.00,0.00,
jcs assistência técnica geladeira freezer e máquina de lavar,,0,,0.00,0.03,
lc assistência técnica máquinas de lavar tanquinhos microondas e geladeiras,,0,,0.00,0.00,
loja de assistência técnica geladeira brastemp,,0,,0.00,0.00,
loja de assistência técnica para geladeiras,,0,,0.00,0.00,
loja de assistência técnica para geladeiras na palhoça,,0,,0.00,0.00,
lojas de assistência técnica de geladeira,,0,,0.00,0.00,
lojas de assistência técnica de geladeira duque de caxias,,0,,0.00,0.00,
lojas de assistência técnica de geladeiras brastemp duque,,0,,0.00,0.00,
lojas de assistência técnica de geladeiras brastemp duque de caxias,,0,,0.00,0.00,
lojas de assistência técnica geladeira da electrolux da serra,,0,,0.00,0.00,
lugares onde tem assistência técnica geladeira continental 460,,0,,0.00,0.00,
líder assistência técnica em máquina de lavar e geladeira,,0,,0.00,0.00,
maq service assistência técnica de geladeira e máquina de lavar,,0,,0.00,0.00,
mecon - assistência técnica /máquina de lavar/lava e seca/geladeiras.,,0,,0.00,0.00,
mega rio assistência técnica de geladeira rj,,0,,0.00,0.00,
melhor assistência técnica de geladeiras,,0,,0.00,0.00,
mini geladeira fixxar assistência técnica,,0,,0.00,0.00,
modelo de termo de garantia para geladeira para assistência técnica,,0,,0.00,0.00,
mp assistência técnica geladeira ge 24h cariacica,,0,,0.00,0.00,
new tec assistência técnica geladeiras maquinas de lavar e microondas,,0,,0.00,0.00,
nipomaq assistência técnica geladeira máquina de lavar e secadora,,0,,0.00,0.00,
numero da assistência técnica da eletrolux geladeiras,,0,,0.00,0.00,
numero da assistência técnica de geladeira da eletrolux,,0,,0.00,0.00,
número da samsung assistência técnica autorizada geladeira rio de janeiro,,0,,0.00,0.00,
número de assistência técnica de geladeira aqui em marília,,0,,0.00,0.00,
número de assistência técnica em geladeira de salvador,,0,,0.00,0.00,
número de assistências técnicas em geladeira,,0,,0.00,0.00,
olx assistência técnica de geladeira bosch,,0,,0.00,0.00,
onde tem assistência técnica da continental geladeira,,0,,0.00,0.00,
onde tem assistência técnica para geladeira em rio doce olinda,,0,,0.00,0.00,
os guri da geladeira assistência técnica são leopoldo - rs,,0,,0.00,0.00,
panasonic geladeira assistência técnica sp,,0,,0.00,0.00,
panfleto assistência técnica geladeira,,0,,0.00,0.00,
parque do carmo assistência técnica geladeira,,0,,0.00,0.00,
pecas para assistência técnica de geladeira,,0,,0.00,0.00,
peça e assistência técnica de geladeira em jundiai,,0,,0.00,0.00,
pior assistência técnica geladeiras,,0,,0.00,0.00,
pirituba assistência técnica geladeira electrolux,,0,,0.00,0.00,
placa geladeira electrolux df46 assistência técnica,,0,,0.00,0.00,
polo assistência técnica geladeira,,0,,0.00,0.00,
pontual assistência técnica de geladeira bh,,0,,0.00,0.00,
pontual assistência técnica de geladeira em bh,,0,,0.00,0.00,
por favor o telefone da assistência técnica da electrolux geladeira,,0,,0.00,0.00,
porto seguro assistência técnica geladeira,,0,,0.00,0.00,
poços de caldas assistência técnica da consu geladeira,,0,,0.00,0.00,
prazo assistência técnica geladeira,,0,,0.00,0.00,
preco assistente técnica geladeira panasonic,,0,,0.00,0.00,
qual a melhor assistência técnica de geladeiras de itapevi,,0,,0.00,0.00,
qual melhor assistência técnica consertar geladeira,,0,,0.00,0.00,
qual prazo para assistência técnica arrumar uma geladeira na garantia,,0,,0.00,0.00,
rd geladeira - assistência técnica são paulo - sp,,0,,0.00,0.00,
refam assistência técnica de geladeira freezer e bebedouro,,0,,0.00,0.00,
refrigeração brastec assistência técnica em geladeiras,,0,,0.00,0.00,
refrigeração garcia - assistência técnica de geladeiras e máquinas,,0,,0.00,0.00,
refrihelp assistência técnica de geladeira maquin,,0,,0.00,0.00,
refrihelp assistência técnica de geladeira maquin cnpj,,0,,0.00,0.00,
refritec maq - assistência técnica geladeiras e máquinas de lavar,,0,,0.00,0.00,
refritecniko - assistência técnica em geladeira,,0,,0.00,0.00,
refritecniko - assistência técnica em geladeira goiânia - go,,0,,0.00,0.00,
reparcon - assistência técnica de geladeira e máquina de lavar,,0,,0.00,0.00,
responsabilidade da assistência técnica que nao conserta geladeira,,0,,0.00,0.00,
responsabilidade da assistência técnica que nao consertou geladeira,,0,,0.00,0.00,
revendedora assistência técnica da geladeira resfriar em uberlândia,,0,,0.00,0.00,
s.o.s geladeiras & lavadoras assistência técnica teresina - pi,,0,,0.00,0.00,
sabtec assistência técnica geladeiras e lavadouras ltda-me suzano - sp,,0,,0.00,0.00,
samsung assistência técnica geladeira,,0,,0.00,0.00,
samsung assistência técnica geladeira ribeirão,,0,,0.00,0.00,
samsung assistência técnica na bahia geladeira,,0,,0.00,0.00,
se assistência técnica quiser levar minha geladeira eu deixo,,0,,0.00,0.00,
sm assistência técnica de máquinas de lavar e geladeira,,0,,0.00,0.00,
surubim pe assistência técnica de geladeira,,0,,0.00,0.00,
tecnolar assistência técnica conserto de maquina de lavar geladeira,,0,,0.00,0.00,
tecnolar assistência técnica conserto de maquina de lavar geladeira mg,,0,,0.00,0.00,
tecnolar assistência técnica conserto de maquinade lavar geladeira betim mg,,0,,0.00,0.00,
telefone assistência técnica geladeira ge em taubaté,,0,,0.00,0.00,
telefone assistência técnica geladeira gelopar,,0,,0.00,0.00,
telefone assistência técnica panasonic geladeira,,0,,0.00,0.00,
telefone da assistência técnica autorizada de geladeira samsung salvador,,0,,0.00,0.00,
telefone da coca-cola assistência técnica de geladeiras,,0,,0.00,0.00,
telefone de assistência técnica de geladeira na av cupecê,,0,,0.00,0.00,
telefone de assistência técnica de geladeira no veneza,,0,,0.00,0.00,
telefone de assistência técnicas de geladeiras em sete lagoas,,0,,0.00,0.00,
telefones assistência técnica d de geladeiras bosch em sorocaba,,0,,0.00,0.00,
telefones de assistência técnica autorizada geladeira ge,,0,,0.00,0.00,
telwfone assistência técnica geladeira,,0,,0.00,0.00,
técnico de geladeira na avenida águia de haia assistência técnica,,0,,0.00,0.00,
técnico em assistência técnica em geladeira no barreiro de cima,,0,,0.00,0.00,
visa service assistência técnica de geladeira,,0,,0.00,0.00,
