Keyword,Intent,Volume,Keyword Difficulty,CPC (USD),Competitive Density,SERP Features
assistência técnica em geladeira,Commercial,2400,45,0.93,0.50,"Sitelinks, Video, People also ask, Local pack, Related searches"
assistência técnica para geladeira electrolux,Navigational,1300,36,0.74,0.75,"Sitelinks, Image, People also ask, Local pack, Related searches, Ads top, Ads bottom, Ads middle"
assistência técnica de geladeira,Commercial,880,15,0.88,0.61,"Sitelinks, Image, Image pack, Video, Local pack, Related searches"
assistência técnica electrolux geladeira,"Navigational, Transactional",720,48,0.78,0.79,"Sitelinks, Image, Video, Local pack, Related searches, Ads bottom"
assistência técnica geladeira,Commercial,720,35,0.95,0.56,"Sitelinks, Image, Video, Local pack, Related searches"
assistência técnica geladeira brastemp,Navigational,720,32,0.71,0.73,"Sitelinks, People also ask, Local pack, Related searches, Ads bottom"
assistência técnica geladeira electrolux,Navigational,590,39,0.73,0.79,"Sitelinks, Video, Local pack, Related searches"
assistência técnica panasonic geladeira,Commercial,590,31,0.55,0.65,"Sitelinks, Video, People also ask, Local pack, Related searches, Ads bottom"
panasonic geladeira assistência técnica,Commercial,590,35,0.55,0.65,"Sitelinks, Video, Local pack, Related searches"
assistência técnica brastemp geladeira,Navigational,480,49,0.79,0.75,"Sitelinks, Image, Local pack, Related searches, Ads bottom"
assistência técnica geladeira panasonic,Commercial,260,35,0.55,0.65,"Sitelinks, Video, Local pack, Related searches, Ads bottom"
assistência técnica continental geladeira,Commercial,170,7,0.54,0.77,"Video, People also ask, Local pack, Related searches, Ads bottom"
assistência técnica de geladeira perto de mim,Transactional,170,35,0.70,0.66,"Image, Image pack, Video, People also ask, Local pack, Related searches, Ads bottom"
assistência técnica da geladeira continental,Commercial,140,6,0.54,0.77,"Image pack, Video, People also ask, Local pack, Related searches"
assistência técnica de geladeira electrolux,Navigational,140,12,0.69,0.66,"Sitelinks, Image, Image pack, People also ask, Local pack, Related searches, Ads bottom"
assistência técnica em geladeiras,Commercial,140,28,0.84,0.82,"Sitelinks, Video, Video carousel, Local pack, Related searches"
assistência técnica para geladeira,Commercial,110,35,0.84,0.82,"Sitelinks, Image, Video, Video carousel, Local pack, Related searches"
assistência técnica resfriar geladeira,Navigational,110,18,0.40,0.63,"Video, Video carousel, Local pack, Related searches"
iceblue refrigeração conserto de geladeira assistência técnica,,110,,0.55,0.15,
assistência técnica de geladeira brastemp,Navigational,90,33,0.76,0.72,"Sitelinks, Image, Local pack, Related searches, Ads bottom"
assistência técnica de geladeira mais próximo,Commercial,90,34,0.70,0.66,"Sitelinks, Image, Video, Local pack, Related searches"
assistência técnica geladeira consul,,90,,0.64,0.73,
assistência técnica geladeira ge,Informational,90,7,0.79,0.69,"Sitelinks, Image, Knowledge panel, Related searches, Ads bottom"
assistência técnica geladeira perto de mim,Transactional,90,35,0.81,0.60,"Sitelinks, AI Overview, Image, Video, Related searches"
rd geladeira assistência técnica,,90,,0.46,0.10,
assistência técnica geladeira bosch,,70,,0.67,0.62,
assistência técnica geladeira bosch mais próxima,,70,,0.50,0.62,
assistência técnica geladeira electrolux perto de mim,,70,,0.84,0.68,
geladeira electrolux assistência técnica,,70,,0.74,0.76,
assistência técnica consul geladeira,,50,,0.52,0.65,
assistência técnica de geladeira de caminhão,,50,,0.27,0.18,
assistência técnica geladeira samsung,,50,,0.91,0.75,
assistência técnica samsung geladeira,,50,,0.88,0.76,
bh conserto de geladeira assistência técnica de máquina de lavar,,50,,0.00,0.01,
geladeira assistência técnica,,50,,1.14,0.58,
panasonic assistência técnica autorizada geladeira,,50,,0.38,0.55,
assistência técnica bosch geladeira,,40,,0.67,0.62,
assistência técnica geladeira lg,,40,,0.76,0.77,
assistência técnica samsung geladeira side by side,,40,,0.64,0.79,
electrolux geladeira assistência técnica,,40,,0.74,0.76,
eletrogelar assistência técnica conserto de lavadora e geladeira,,40,,0.00,0.02,
geladeira panasonic assistência técnica,,40,,0.51,0.67,
mecon assistência técnica máquina de lavar lava e seca geladeiras,,40,,0.00,0.01,
os guri da geladeira assistência técnica são leopoldo rs,,40,,0.34,0.57,
refrigeração garcia assistência técnica de geladeiras e máquinas,,40,,0.50,0.46,
assistência técnica da geladeira electrolux,,30,,0.75,0.79,
assistência técnica da geladeira panasonic,,30,,0.51,0.60,
assistência técnica de geladeira consul,,30,,0.51,0.84,
assistência técnica de geladeira na zona leste,,30,,0.00,0.00,
assistência técnica de geladeira panasonic,,30,,0.61,0.51,
assistência técnica de geladeiras,,30,,0.80,0.61,
assistência técnica geladeira 24 horas sp,,30,,0.89,0.69,
assistência técnica geladeira continental,,30,,0.55,0.75,
assistência técnica geladeiras,,30,,0.94,0.58,
assistência técnica autorizada electrolux geladeira,,20,,0.71,0.47,
assistência técnica autorizada geladeira electrolux,,20,,0.28,0.61,
assistência técnica autorizada geladeira samsung,,20,,0.37,0.69,
assistência técnica autorizada panasonic geladeira,,20,,0.27,0.40,
assistência técnica autorizada samsung geladeira,,20,,0.55,0.58,
assistência técnica da brastemp geladeira,,20,,0.88,0.90,
assistência técnica da consul geladeira,,20,,0.39,0.80,
assistência técnica da electrolux geladeira,,20,,0.67,0.86,
assistência técnica da geladeira bosch,,20,,1.67,0.89,
assistência técnica da geladeira brastemp,,20,,0.63,0.63,
assistência técnica da geladeira consul,,20,,0.43,0.73,
assistência técnica da geladeira resfriar,,20,,0.31,0.42,
assistência técnica da geladeira samsung,,20,,0.70,0.44,
assistência técnica da panasonic geladeira,,20,,0.43,0.72,
assistência técnica de geladeira 24 horas,,20,,0.46,0.82,
assistência técnica de geladeira elber,,20,,0.39,0.70,
assistência técnica de geladeira em diadema,,20,,0.92,0.86,
assistência técnica de geladeira em guarulhos,,20,,0.57,1.00,
assistência técnica de geladeira em itapecerica da serra,,20,,0.00,0.64,
assistência técnica de geladeira em perdizes,,20,,0.00,0.00,
assistência técnica de geladeira em recife,,20,,0.00,1.00,
assistência técnica de geladeira em santana,,20,,0.00,0.00,
assistência técnica de geladeira na mooca,,20,,0.00,0.00,
assistência técnica de geladeira na vila nova conceição,,20,,0.00,0.00,
assistência técnica de geladeira na vila olímpia,,20,,0.00,0.00,
assistência técnica de geladeira na zona norte,,20,,0.00,0.00,
assistência técnica de geladeira na zona sul,,20,,0.00,0.00,
assistência técnica de geladeira no tatuapé,,20,,0.00,0.00,
assistência técnica de geladeira samsung,,20,,0.66,0.80,
assistência técnica elber geladeiras,,20,,0.39,0.58,
assistência técnica electrolux casa das geladeiras,,20,,0.00,0.33,
assistência técnica em geladeira brastemp,,20,,0.94,0.69,
assistência técnica em geladeira electrolux,,20,,0.81,0.58,
assistência técnica geladeira 24 horas,,20,,0.56,0.58,
assistência técnica geladeira bosch rj,,20,,0.00,0.00,
assistência técnica geladeira brastemp perto de mim,,20,,0.83,0.81,
assistência técnica geladeira elber,,20,,0.44,0.68,
assistência técnica geladeira elber em cuiabá,,20,,0.56,0.44,
assistência técnica geladeira electrolux divinópolis,,20,,0.00,0.36,
assistência técnica geladeira electrolux ribeirão preto,,20,,0.19,0.19,
assistência técnica geladeira electrolux uberlândia,,20,,0.00,0.79,
assistência técnica geladeira expositora,,20,,0.91,0.65,
assistência técnica geladeira ge side by side,,20,,0.78,0.71,
assistência técnica geladeira panasonic belém,,20,,0.21,0.43,
assistência técnica geladeira resfriar,,20,,0.37,0.63,
assistência técnica para geladeira brastemp,,20,,0.69,0.92,
assistência técnica para geladeira consul,,20,,0.88,0.71,
brastemp assistência técnica autorizada geladeira,,20,,0.47,0.79,
brastemp assistência técnica geladeira,,20,,0.89,0.92,
brastemp geladeira assistência técnica,,20,,1.05,0.94,
conserto geladeira bh rapidão assistência técnica,,20,,1.28,1.00,
electrolux assistência técnica geladeira,,20,,1.01,0.94,
geladeira continental assistência técnica,,20,,0.44,0.53,
geladeira panasonic assistência técnica autorizada,,20,,0.52,0.53,
solitec assistência técnica geladeira e maquina de lavar,,20,,0.23,0.50,
tec maq assistência técnica maquinas de lavar e geladeiras ltda,,20,,0.62,0.62,
telefone de assistência técnica de geladeira,,20,,0.78,0.77,
assistência técnica da geladeira midea,,10,,0.49,0.86,
assistência técnica de geladeira em higienópolis,,10,,0.00,0.00,
assistência técnica de geladeira em moema,,10,,0.00,0.00,
assistência técnica de geladeira em pinheiros,,10,,0.00,0.00,
assistência técnica de geladeira em são paulo,,10,,0.00,0.00,
assistência técnica de geladeira na casa verde,,10,,0.00,0.00,
assistência técnica de geladeira na cidade jardim,,10,,0.00,0.00,
assistência técnica de geladeira na vila mariana,,10,,0.00,0.00,
assistência técnica de geladeira na zona oeste,,10,,0.00,0.00,
assistência técnica de geladeira no brooklin,,10,,0.00,0.00,
assistência técnica de geladeira no campo belo,,10,,0.00,0.00,
assistência técnica de geladeira no ibirapuera,,10,,0.00,0.00,
assistência técnica de geladeira no itaim bibi,,10,,0.00,0.00,
assistência técnica de geladeira no jardim paulista,,10,,0.00,0.00,
assistência técnica de geladeira no morumbi,,10,,0.00,0.00,
assistência técnica geladeira belo horizonte mg,,10,,0.00,0.00,
assistência técnica geladeira continental rj,,10,,1.00,0.75,
assistência técnica geladeira electrolux mogi das cruzes,,10,,0.21,0.71,
assistência técnica geladeira ge sp,,10,,0.00,0.00,
assistência técnica geladeira midea,,10,,0.50,0.54,
assistência técnica midea geladeira,,10,,0.67,0.69,
conserto geladeira barreiro assistência técnica,,10,,0.00,0.00,
geladeira ge assistência técnica,,10,,0.72,0.70,
panasonic assistência técnica geladeira,,10,,0.45,0.48,
rd geladeira - assistência técnica,,10,,0.00,0.00,
samsung geladeira assistência técnica,,10,,0.91,0.75,
telefone da assistência técnica da consul geladeira,,10,,0.59,0.66,
a empresa podenlevar minha geladeira para assistência técnica,,0,,0.00,0.00,
abbastec-campinas assistência técnica geladeiras e máquinas,,0,,0.00,0.00,
acessórios e assistência técnica dako geladeiras,,0,,0.00,0.00,
ag assistência técnica geladeira brastemp electrolux são paulo sp,,0,,0.00,0.00,
aliança fogão e geladeira assistência técnica salvador ba,,0,,0.00,0.00,
aplicativo assistência técnica de geladeira,,0,,0.00,0.00,
as abra assistência técnica em osasco em conserto de geladeira,,0,,0.00,0.00,
assistencia geladeira 24 horas assistência técnica balneário camboriú sc,,0,,0.00,0.00,
assistente assistência técnica de geladeira em carapicuíba,,0,,0.00,0.00,
assistente técnica de geladeira brastemp em taguatinga,,0,,0.00,0.00,
assistente técnica de geladeira em rio preto,,0,,0.00,0.00,
assistente técnica de geladeira na joão ventura,,0,,0.00,0.00,
assistente técnica geladeira,,0,,0.00,0.00,
assistente técnica geladeira taubaté,,0,,0.00,0.00,
assistente técnica geladeiras bertioga,,0,,0.00,0.00,
assistente técnico electrolux geladeira,,0,,0.00,0.00,
assistente técnico eletrolux geladeira,,0,,0.00,0.00,
assistir assistência técnica de geladeira 24 horas sorocaba,,0,,0.00,0.00,
assistência assistência técnica de geladeira,,0,,0.00,0.00,
assistência assistência técnica geladeira ge caxias,,0,,0.00,0.00,
assistência assistência técnica para geladeira na cidade tiradentes,,0,,0.00,0.00,
assistência técnica & geladeira & santo andré & 24 horas,,0,,0.00,0.00,
assistência técnica & geladeira continental & abc & 24 horas,,0,,0.00,0.00,
assistência técnica 24h porto velho geladeira,,0,,0.00,0.00,
assistência técnica aracaju geladeira electrolux,,0,,0.00,0.00,
assistência técnica augorizada geladeira ge em vitoria-es,,0,,0.00,0.00,
assistência técnica auorizada geladeira electrolux,,0,,0.00,0.00,
assistência técnica autorizada consul belem para geladeira,,0,,0.00,0.00,
assistência técnica autorizada dako geladeira,,0,,0.00,0.00,
assistência técnica autorizada electrolux geladeira são paulo,,0,,0.00,0.00,
assistência técnica autorizada geladeira bosch,,0,,0.00,0.00,
assistência técnica autorizada geladeira continental em aracaju,,0,,0.00,0.00,
assistência técnica autorizada geladeira electrolux na zona leste,,0,,0.00,0.00,
assistência técnica autorizada geladeira ge em vitoria-es,,0,,0.00,0.00,
assistência técnica autorizada geladeira panasonic,,0,,0.00,0.00,
assistência técnica autorizada geladeira panasonic belém,,0,,0.00,0.00,
assistência técnica autorizada geladeira panasonic em fortaleza,,0,,0.00,0.00,
assistência técnica autorizada geladeira panasonicg,,0,,0.00,0.00,
assistência técnica autorizada lg juiz de fora geladeira,,0,,0.00,0.00,
assistência técnica autorizada para geladeira em caieiras,,0,,0.00,0.00,
assistência técnica autorizada para geladeira ge eletroliux,,0,,0.00,0.00,
assistência técnica autorizada para geladeira ge em caieiras,,0,,0.00,0.00,
assistência técnica avenida campinas de geladeiras,,0,,0.00,0.00,
assistência técnica balcao geladeira,,0,,0.00,0.00,
assistência técnica barros junior geladeira nova iguaçu,,0,,0.00,0.00,
assistência técnica bosch em curitiba geladeira,,0,,0.00,0.00,
assistência técnica bosch geladeira belo horizonte,,0,,0.00,0.00,
assistência técnica bosch geladeira belo horizonte mg,,0,,0.00,0.00,
assistência técnica bosch geladeira ipiranga,,0,,0.00,0.00,
assistência técnica bosch geladeira m.urussanga,,0,,0.00,0.00,
assistência técnica bosch geladeira niterói,,0,,0.00,0.00,
assistência técnica bosch geladeira no ipiranga,,0,,0.00,0.00,
assistência técnica bosch geladeira nova iguaçu,,0,,0.00,0.00,
assistência técnica bosch geladeira santarém pará,,0,,0.00,0.00,
assistência técnica bosch geladeira sao carlos sp,,0,,0.00,0.00,
assistência técnica bosch geladeira uberlandia,,0,,0.00,0.00,
assistência técnica bosch limeira geladeira,,0,,0.00,0.00,
assistência técnica bosh geladeira sao carlos sp,,0,,0.00,0.00,
assistência técnica brastemp de geladeira em macapá,,0,,0.00,0.00,
assistência técnica brastemp em mogi guaçuconserto geladeira mogi guaçu,,0,,0.00,0.00,
assistência técnica brastemp geladeira curitiba,,0,,0.00,0.00,
assistência técnica brastemp geladeira jundiaí,,0,,0.00,0.00,
assistência técnica brastemp geladeira manaus,,0,,0.00,0.00,
assistência técnica brastemp geladeira ribeirão preto,,0,,0.00,0.00,
assistência técnica brastemp geladeira rio de janeiro,,0,,0.00,0.00,
assistência técnica brastemp geladeira rj,,0,,0.00,0.00,
assistência técnica brastemp geladeira zona leste,,0,,0.00,0.00,
assistência técnica brastemp geladeira zona oeste,,0,,0.00,0.00,
assistência técnica brastemp geladeiras,,0,,0.00,0.00,
assistência técnica brastemp geladeiras vila velha es,,0,,0.00,0.00,
assistência técnica brastemp vila velha es geladeiras vila velha es,,0,,0.00,0.00,
assistência técnica concerto de geladeira da consul,,0,,0.00,0.00,
assistência técnica consersta geladeiras em são josé,,0,,0.00,0.00,
assistência técnica conserto de geladeira duplex electrolux rj,,0,,0.00,0.00,
assistência técnica conserto de geladeira duplex lg rj,,0,,0.00,0.00,
assistência técnica conserto de geladeira duplex samsung rj,,0,,0.00,0.00,
assistência técnica conserto de geladeira e maquina de lavar roupas,,0,,0.00,0.00,
assistência técnica conserto de geladeira electrolux rio de janeiro rj,,0,,0.00,0.00,
assistência técnica conserto de geladeira electrolux rj,,0,,0.00,0.00,
assistência técnica conserto de geladeira em boa viagem,,0,,0.00,0.00,
assistência técnica conserto de geladeira french door electrolux rj,,0,,0.00,0.00,
assistência técnica conserto de geladeira lg recreio dos bandeirantes rj,,0,,0.00,0.00,
assistência técnica conserto de geladeira lg rio de janeiro rj,,0,,0.00,0.00,
assistência técnica conserto de geladeira lg rj,,0,,0.00,0.00,
assistência técnica conserto de geladeira rj,,0,,0.00,0.00,
assistência técnica conserto de geladeira samsung barra da tijuca rj,,0,,0.00,0.00,
assistência técnica conserto de geladeira samsung rj,,0,,0.00,0.00,
assistência técnica conserto de geladeira side by side electrolux rj,,0,,0.00,0.00,
assistência técnica conserto geladeira maua,,0,,0.00,0.00,
assistência técnica consul geladeira em zona leste,,0,,0.00,0.00,
assistência técnica consul geladeira emautaz mirim,,0,,0.00,0.00,
assistência técnica consul geladeira petrolina,,0,,0.00,0.00,
assistência técnica consul geladeira rio das ostras,,0,,0.00,0.00,
assistência técnica consul geladeira rj reclamações,,0,,0.00,0.00,
assistência técnica consul geladeira rj é de confiança,,0,,0.00,0.00,
assistência técnica consul geladeira são paulo,,0,,0.00,0.00,
assistência técnica consul geladeira zona sul.rj,,0,,0.00,0.00,
assistência técnica continental geladeira campo grande,,0,,0.00,0.00,
assistência técnica continental geladeira em cruz alta rs,,0,,0.00,0.00,
assistência técnica continental geladeira em taguatinga norte df,,0,,0.00,0.00,
assistência técnica continental geladeira goiania go,,0,,0.00,0.00,
assistência técnica continental geladeira londrina,,0,,0.00,0.00,
assistência técnica cônsul geladeira uberlândia,,0,,0.00,0.00,
assistência técnica da bosch geladeira,,0,,0.00,0.00,
assistência técnica da brastemp geladeira em guarulhos,,0,,0.00,0.00,
assistência técnica da brastemp geladeira em manaus endereço,,0,,0.00,0.00,
assistência técnica da brastemp geladeira na região dos lagos,,0,,0.00,0.00,
assistência técnica da brastemp geladeira na reio dos lagos,,0,,0.00,0.00,
assistência técnica da brastemp geladeira no butantã,,0,,0.00,0.00,
assistência técnica da brastemp geladeira no rj,,0,,0.00,0.00,
assistência técnica da consul de geladeira no barro preto,,0,,0.00,0.00,
assistência técnica da consul geladeira antiga,,0,,0.00,0.00,
assistência técnica da consul geladeira na ilha do governador,,0,,0.00,0.00,
assistência técnica da continental geladeira,,0,,0.55,0.75,
assistência técnica da continental geladeira jundiaí,,0,,0.00,0.00,
assistência técnica da dako geladeira,,0,,0.00,0.00,
assistência técnica da electrolux em são caetano geladeira,,0,,0.00,0.00,
assistência técnica da electrolux geladeira em curitiba,,0,,0.00,0.00,
assistência técnica da electrolux geladeira em teresina,,0,,0.00,0.00,
assistência técnica da geladeira,,0,,0.00,0.00,
assistência técnica da geladeira consul em jequie,,0,,0.00,0.00,
assistência técnica da geladeira continental em itabuna ba,,0,,0.00,0.00,
assistência técnica da geladeira continental em piracicaba,,0,,0.00,0.00,
assistência técnica da geladeira dako,,0,,0.00,0.00,
assistência técnica da geladeira dako em campinas,,0,,0.00,0.00,
assistência técnica da geladeira do guarana antarctica,,0,,0.00,0.00,
assistência técnica da geladeira electrolux em ubatuba,,0,,0.00,0.00,
assistência técnica da geladeira electrolux simoes,,0,,0.00,0.00,
assistência técnica da geladeira eletrolux,,0,,0.00,0.00,
assistência técnica da geladeira eletrolux em belém,,0,,0.00,0.00,
assistência técnica da geladeira mabe campinas,,0,,0.00,0.00,
assistência técnica da geladeira resfriar em cuiabá,,0,,0.00,0.00,
assistência técnica da geladeira resfriar em uberlândia,,0,,0.00,0.00,
assistência técnica da geladeira samsung em maringá,,0,,0.00,0.00,
assistência técnica da panasonic de geladeiras,,0,,0.00,0.00,
assistência técnica da panasonic geladeira em belém,,0,,0.00,0.00,
assistência técnica da rua monsenhor gercino de geladeira,,0,,0.00,0.00,
assistência técnica da samsung geladeira em teresópolis,,0,,0.00,0.00,
assistência técnica da samsung geladeira é aonde,,0,,0.00,0.00,
assistência técnica dako geladeira balneário camboriú sc,,0,,0.00,0.00,
assistência técnica dako geladeira saude,,0,,0.00,0.00,
assistência técnica dako geladeiras em porto alegre zona sul,,0,,0.00,0.00,
assistência técnica danificou minha geladeira,,0,,0.00,0.00,
assistência técnica das geladeiras da coca cola,,0,,0.00,0.00,
assistência técnica das geladeiras élber em governador valadaresros,,0,,0.00,0.00,
assistência técnica das geladeiras élber em guanambi bahia,,0,,0.00,0.00,
assistência técnica das geladeiras élber em montes claros,,0,,0.00,0.00,
assistência técnica de conserto de geladeira,,0,,0.00,0.00,
assistência técnica de conserto de geladeira em navegantes sc,,0,,0.00,0.00,
assistência técnica de conserto de geladeira em resende,,0,,0.00,0.00,
assistência técnica de conseto de geladeira,,0,,0.00,0.00,
assistência técnica de filtro de geladeira,,0,,0.00,0.00,
assistência técnica de fogão e geladeira em suzano,,0,,0.00,0.00,
assistência técnica de freezer e geladeira cerro grande do sul,,0,,0.00,0.00,
assistência técnica de freezer geladeira sertão santana,,0,,0.00,0.00,
assistência técnica de geladeira 24 volts,,0,,0.00,0.00,
assistência técnica de geladeira 24h,,0,,0.00,0.00,
assistência técnica de geladeira bairro padre eustaquio,,0,,0.00,0.00,
assistência técnica de geladeira barreias ba,,0,,0.00,0.00,
assistência técnica de geladeira boche,,0,,0.00,0.00,
assistência técnica de geladeira bosch,,0,,0.00,0.00,
assistência técnica de geladeira bosch em goiânia goiás,,0,,0.00,0.00,
assistência técnica de geladeira bosch goiânia go,,0,,0.00,0.00,
assistência técnica de geladeira bosch sao carlos sp,,0,,0.00,0.00,
assistência técnica de geladeira brasilia campinas,,0,,0.00,0.00,
assistência técnica de geladeira brasilia vinhedo,,0,,0.00,0.00,
assistência técnica de geladeira brastemp em belém do oara,,0,,0.00,0.00,
assistência técnica de geladeira brastemp em jundiai,,0,,0.00,0.00,
assistência técnica de geladeira brastemp em santo andré avenida perimetral,,0,,0.00,0.00,
assistência técnica de geladeira brastemp em sao vicente,,0,,0.00,0.00,
assistência técnica de geladeira brastemp frost free ative,,0,,0.00,0.00,
assistência técnica de geladeira brastemp joinville,,0,,0.00,0.00,
assistência técnica de geladeira brastemp vila maria zona norte sp,,0,,0.00,0.00,
assistência técnica de geladeira cic,,0,,0.00,0.00,
assistência técnica de geladeira cidade dutra sp,,0,,0.00,0.00,
assistência técnica de geladeira consul de betim minas gerais,,0,,0.00,0.00,
assistência técnica de geladeira consul em belo horizonte,,0,,0.00,0.00,
assistência técnica de geladeira consul em francisco morato,,0,,0.00,0.00,
assistência técnica de geladeira consul em porto alegre,,0,,0.00,0.00,
assistência técnica de geladeira consul em vila velha es,,0,,0.00,0.00,
assistência técnica de geladeira consul fortaleza,,0,,0.00,0.00,
assistência técnica de geladeira continental,,0,,0.57,0.78,
assistência técnica de geladeira continental em salvador,,0,,0.00,0.00,
assistência técnica de geladeira continental em sp,,0,,0.00,0.00,
assistência técnica de geladeira da brastemp diadema,,0,,0.00,0.00,
assistência técnica de geladeira dako,,0,,0.00,0.00,
assistência técnica de geladeira dako em sp,,0,,0.00,0.00,
assistência técnica de geladeira de joinville,,0,,0.00,0.00,
assistência técnica de geladeira e bebedouros em ariquemes ro,,0,,0.00,0.00,
assistência técnica de geladeira eldorado contagem mg,,0,,0.00,0.00,
assistência técnica de geladeira electrolux em americana,,0,,0.00,0.00,
assistência técnica de geladeira electrolux em belém,,0,,0.00,0.00,
assistência técnica de geladeira electrolux em belém telefone,,0,,0.00,0.00,
assistência técnica de geladeira electrolux em j monlevade,,0,,0.00,0.00,
assistência técnica de geladeira electrolux em lauro de freitas,,0,,0.00,0.00,
assistência técnica de geladeira electrolux em santo andré,,0,,0.00,0.00,
assistência técnica de geladeira electrolux em são josé,,0,,0.00,0.00,
assistência técnica de geladeira electrolux na freguesia do ó,,0,,0.00,0.00,
assistência técnica de geladeira electrolux na moóca,,0,,0.00,0.00,
assistência técnica de geladeira electrolux no tatuapé,,0,,0.00,0.00,
assistência técnica de geladeira electrolux rua são clemente rj,,0,,0.00,0.00,
assistência técnica de geladeira electrolux tatuapé,,0,,0.00,0.00,
assistência técnica de geladeira eletrolux,,0,,0.69,0.58,
assistência técnica de geladeira eletrolux dc 50,,0,,0.00,0.00,
assistência técnica de geladeira eletrolux em atibaia,,0,,0.00,0.00,
assistência técnica de geladeira eletrolux em canoas,,0,,0.00,0.00,
assistência técnica de geladeira eletrolux ribeirão preto,,0,,0.00,0.00,
assistência técnica de geladeira em aracaju,,0,,0.00,0.00,
assistência técnica de geladeira em arapongas,,0,,0.00,0.00,
assistência técnica de geladeira em araucária,,0,,0.00,0.00,
assistência técnica de geladeira em araçoiaba da serra,,0,,0.00,0.00,
assistência técnica de geladeira em arujá,,0,,0.00,0.00,
assistência técnica de geladeira em betim,,0,,0.00,0.00,
assistência técnica de geladeira em bh,,0,,0.00,0.00,
assistência técnica de geladeira em bh venda nova,,0,,0.00,0.00,
assistência técnica de geladeira em bonfinópolis go,,0,,0.00,0.00,
assistência técnica de geladeira em cajamar,,0,,0.00,0.00,
assistência técnica de geladeira em cajamar polvilho,,0,,0.00,0.00,
assistência técnica de geladeira em campinas,,0,,0.00,0.00,
assistência técnica de geladeira em campo grande rj,,0,,0.00,0.00,
assistência técnica de geladeira em canoas,,0,,0.00,0.00,
