Keyword,Intent,Volume,Keyword Difficulty,CPC (USD),Competitive Density,SERP Features
assistência técnica de geladeira em carapicuíba,,0,,0.00,0.00,
assistência técnica de geladeira em ceilândia,,0,,0.00,0.00,
assistência técnica de geladeira em cotia,,0,,0.00,0.00,
assistência técnica de geladeira em espírito santo do pinhal,,0,,0.00,0.00,
assistência técnica de geladeira em feira de santana,,0,,0.00,0.00,
assistência técnica de geladeira em franco da rocha,,0,,0.00,0.00,
assistência técnica de geladeira em guaramirim,,0,,0.00,0.00,
assistência técnica de geladeira em hortolândia,,0,,0.00,0.00,
assistência técnica de geladeira em ibirité,,0,,0.00,0.00,
assistência técnica de geladeira em ibiúna,,0,,0.00,0.00,
assistência técnica de geladeira em itaberaba bahia,,0,,0.00,0.00,
assistência técnica de geladeira em itapema,,0,,0.00,0.00,
assistência técnica de geladeira em itaquaquecetuba,,0,,0.00,0.00,
assistência técnica de geladeira em itaquera,,0,,0.00,0.00,
assistência técnica de geladeira em itatiba,,0,,0.00,0.00,
assistência técnica de geladeira em itu,,0,,0.00,0.00,
assistência técnica de geladeira em jacareí,,0,,0.00,0.00,
assistência técnica de geladeira em jaraguá do sul,,0,,0.00,0.00,
assistência técnica de geladeira em jundiaí,,0,,0.00,0.00,
assistência técnica de geladeira em limeira,,0,,0.00,0.00,
assistência técnica de geladeira em maceió,,0,,0.00,0.00,
assistência técnica de geladeira em mauá,,0,,0.00,0.00,
assistência técnica de geladeira em osasco,,0,,0.67,0.57,
assistência técnica de geladeira em paranaguá,,0,,0.00,0.00,
assistência técnica de geladeira em perus,,0,,0.00,0.00,
assistência técnica de geladeira em pirajussara,,0,,0.00,0.00,
assistência técnica de geladeira em piraí,,0,,0.00,0.00,
assistência técnica de geladeira em pirituba,,0,,0.00,0.00,
assistência técnica de geladeira em poá sp,,0,,0.00,0.00,
assistência técnica de geladeira em resende,,0,,0.00,0.00,
assistência técnica de geladeira em samambaia,,0,,0.00,0.00,
assistência técnica de geladeira em santarém,,0,,0.00,0.00,
assistência técnica de geladeira em santo amaro,,0,,0.00,0.00,
assistência técnica de geladeira em santo andré,,0,,0.00,0.00,
assistência técnica de geladeira em santoandré,,0,,0.00,0.00,
assistência técnica de geladeira em santos,,0,,0.00,0.00,
assistência técnica de geladeira em sao paulo zona leste,,0,,0.00,0.00,
assistência técnica de geladeira em sao roque,,0,,0.00,0.00,
assistência técnica de geladeira em silvania go,,0,,0.00,0.00,
assistência técnica de geladeira em surubim pe,,0,,0.00,0.00,
assistência técnica de geladeira em suzano,,0,,0.00,0.00,
assistência técnica de geladeira em são josé do rio preto,,0,,0.00,0.00,
assistência técnica de geladeira em são miguel dos campos,,0,,0.00,0.00,
assistência técnica de geladeira em são vicente,,0,,0.00,0.00,
assistência técnica de geladeira em teixeira de freitas,,0,,0.00,0.00,
assistência técnica de geladeira em tucuruí,,0,,0.00,0.00,
assistência técnica de geladeira em uberlândia,,0,,0.00,0.00,
assistência técnica de geladeira em vargem grande,,0,,0.00,0.00,
assistência técnica de geladeira em venda nova,,0,,0.00,0.00,
assistência técnica de geladeira em vila velha es,,0,,0.00,0.00,
assistência técnica de geladeira em zona oeste,,0,,0.00,0.00,
assistência técnica de geladeira em zona oeste sp,,0,,0.00,0.00,
assistência técnica de geladeira em águas de lindóia,,0,,0.00,0.00,
assistência técnica de geladeira emergencial 24h são paulo sp,,0,,0.00,0.00,
assistência técnica de geladeira emsamambaia,,0,,0.00,0.00,
assistência técnica de geladeira esmaltec em castanhal,,0,,0.00,0.00,
assistência técnica de geladeira estrada de taipas,,0,,0.00,0.00,
assistência técnica de geladeira franco da rocha,,0,,0.00,0.00,
assistência técnica de geladeira frigidaire em são josé dos campos-sp,,0,,0.00,0.00,
assistência técnica de geladeira frost free consul,,0,,0.00,0.00,
assistência técnica de geladeira ge,,0,,0.00,0.00,
assistência técnica de geladeira ge em belém,,0,,0.00,0.00,
assistência técnica de geladeira ge em guarulhos,,0,,0.00,0.00,
assistência técnica de geladeira ge em salvador,,0,,0.00,0.00,
assistência técnica de geladeira gravataí,,0,,0.00,0.00,
assistência técnica de geladeira guaianases,,0,,0.00,0.00,
assistência técnica de geladeira intaim paulista,,0,,0.00,0.00,
assistência técnica de geladeira itaguaí,,0,,0.00,0.00,
assistência técnica de geladeira jardim joão xxlll,,0,,0.00,0.00,
assistência técnica de geladeira jardim paulista,,0,,0.00,0.00,
assistência técnica de geladeira juiz de fora,,0,,0.00,0.00,
assistência técnica de geladeira lavras,,0,,0.00,0.00,
assistência técnica de geladeira lavras e região,,0,,0.00,0.00,
assistência técnica de geladeira mabe no df,,0,,0.00,0.00,
assistência técnica de geladeira mais próxima,,0,,0.00,0.00,
assistência técnica de geladeira manaus,,0,,0.00,0.00,
assistência técnica de geladeira mgr,,0,,0.00,0.00,
assistência técnica de geladeira na,,0,,0.00,0.00,
assistência técnica de geladeira na avenida amador bueno na penha,,0,,0.00,0.00,
assistência técnica de geladeira na avenida dos estudantes hortolândia,,0,,0.00,0.00,
assistência técnica de geladeira na baixada santista,,0,,0.00,0.00,
assistência técnica de geladeira na caminho do mar são bernardo,,0,,0.00,0.00,
assistência técnica de geladeira na cidade de lins são paulo,,0,,0.00,0.00,
assistência técnica de geladeira na gávea,,0,,0.00,0.00,
assistência técnica de geladeira na moóca,,0,,0.00,0.00,
assistência técnica de geladeira na penha zona leste,,0,,0.00,0.00,
assistência técnica de geladeira na regiao de taipas,,0,,0.00,0.00,
assistência técnica de geladeira na rua frederico renne.jaegher,,0,,0.00,0.00,
assistência técnica de geladeira na vila alpina,,0,,0.00,0.00,
assistência técnica de geladeira na vila galvão em guarulhos,,0,,0.00,0.00,
assistência técnica de geladeira na vila matilde,,0,,0.00,0.00,
assistência técnica de geladeira na zona leste patriarca,,0,,0.00,0.00,
assistência técnica de geladeira no altoboqueirão,,0,,0.00,0.00,
assistência técnica de geladeira no ayrosa,,0,,0.00,0.00,
assistência técnica de geladeira no ayroza,,0,,0.00,0.00,
assistência técnica de geladeira no bairro itaum em joinville,,0,,0.00,0.00,
assistência técnica de geladeira no benzinho,,0,,0.00,0.00,
assistência técnica de geladeira no centro de são bernardo,,0,,0.00,0.00,
assistência técnica de geladeira no ipiranga,,0,,0.00,0.00,
assistência técnica de geladeira no ipiranga técnica,,0,,0.00,0.00,
assistência técnica de geladeira no itaim paulista,,0,,0.00,0.00,
assistência técnica de geladeira no jardim imperador,,0,,0.00,0.00,
assistência técnica de geladeira no jardim imperador praia grande,,0,,0.00,0.00,
assistência técnica de geladeira no parqui são rafael,,0,,0.00,0.00,
assistência técnica de geladeira no picanço guarulhos sp,,0,,0.00,0.00,
assistência técnica de geladeira no verê paraná,,0,,0.00,0.00,
assistência técnica de geladeira panasonic de araraquara,,0,,0.00,0.00,
assistência técnica de geladeira panasonic e ar condiconado de araraquara,,0,,0.00,0.00,
assistência técnica de geladeira panasonic em itanhaém,,0,,0.00,0.00,
assistência técnica de geladeira panasonic em porto alegre,,0,,0.00,0.00,
assistência técnica de geladeira perto de casa,,0,,0.00,0.00,
assistência técnica de geladeira perus,,0,,0.00,0.00,
assistência técnica de geladeira pn,,0,,0.00,0.00,
assistência técnica de geladeira praia grande,,0,,0.00,0.00,
assistência técnica de geladeira próximo a nova parnamirim,,0,,0.00,0.00,
assistência técnica de geladeira próximo a nova petrópolis,,0,,0.00,0.00,
assistência técnica de geladeira resfriar,,0,,0.00,0.00,
assistência técnica de geladeira ricardo jafet,,0,,0.00,0.00,
assistência técnica de geladeira rio bonito sp,,0,,0.00,0.00,
assistência técnica de geladeira rio de janeiro rj,,0,,0.00,0.00,
assistência técnica de geladeira samambaia,,0,,0.00,0.00,
assistência técnica de geladeira sp,,0,,0.00,0.00,
assistência técnica de geladeira surubim pe,,0,,0.00,0.00,
assistência técnica de geladeira são paulo sp,,0,,0.00,0.00,
assistência técnica de geladeira taboão da serra,,0,,0.00,0.00,
assistência técnica de geladeira tel,,0,,0.00,0.00,
assistência técnica de geladeira uberlandia,,0,,0.00,0.00,
assistência técnica de geladeira vila dos remedios,,0,,0.00,0.00,
assistência técnica de geladeira vila dos remedios rua antonio aryosa,,0,,0.00,0.00,
assistência técnica de geladeira vila maria sp,,0,,0.00,0.00,
assistência técnica de geladeira várzea paulista,,0,,0.00,0.00,
assistência técnica de geladeira.jardim aeroporto,,0,,0.00,0.00,
assistência técnica de geladeiras botafogo,,0,,0.00,0.00,
assistência técnica de geladeiras cachoeirinha rs,,0,,0.00,0.00,
assistência técnica de geladeiras campo limpo paulista,,0,,0.00,0.00,
assistência técnica de geladeiras consul e montes claros,,0,,0.00,0.00,
assistência técnica de geladeiras de jales números de telefone,,0,,0.00,0.00,
assistência técnica de geladeiras de santo andré,,0,,0.00,0.00,
assistência técnica de geladeiras de snto andré,,0,,0.00,0.00,
assistência técnica de geladeiras e máquinas de lavar,,0,,0.00,0.07,
assistência técnica de geladeiras electrolux,,0,,0.00,0.00,
assistência técnica de geladeiras eletrolux,,0,,0.00,0.00,
assistência técnica de geladeiras eletrolux em americana,,0,,0.00,0.00,
assistência técnica de geladeiras eletrolux em capão da canoa rs,,0,,0.00,0.00,
assistência técnica de geladeiras em c,,0,,0.00,0.00,
assistência técnica de geladeiras em gravatai,,0,,0.00,0.00,
assistência técnica de geladeiras em jardim sao paulo recife,,0,,0.00,0.00,
assistência técnica de geladeiras em suzano,,0,,0.00,0.00,
assistência técnica de geladeiras expositoras e frezeer diadema,,0,,0.00,0.00,
assistência técnica de geladeiras gravataí,,0,,0.00,0.00,
assistência técnica de geladeiras máquina de lavar freezer,,0,,0.00,0.00,
assistência técnica de geladeiras panasonic em americana,,0,,0.00,0.00,
assistência técnica de geladeiras tatuapé são paulo - sp,,0,,0.00,0.00,
assistência técnica de geladeiras várzea paulista,,0,,0.00,0.00,
assistência técnica de máquinas e geladeiras,,0,,0.00,0.00,
assistência técnica de peças sansung para geladeiras em jundiai,,0,,0.00,0.00,
assistência técnica de placa de geladeira aqui no leblon,,0,,0.00,0.00,
assistência técnica dr geladeira em maceió,,0,,0.00,0.00,
assistência técnica e conserto de maquinas de lavar microondas geladeiras,,0,,0.00,0.00,
assistência técnica e geladeira em santo andré & 24 horas,,0,,0.00,0.00,
assistência técnica e geladeira vila dos renedios,,0,,0.00,0.00,
assistência técnica e geladeira zn,,0,,0.00,0.00,
assistência técnica e manutenção geladeiras brastemp rj,,0,,0.00,0.00,
assistência técnica electrolux casa das geladeiras são paulo - sp,,0,,0.00,0.00,
assistência técnica electrolux em geladeiras,,0,,0.00,0.00,
assistência técnica electrolux em salto geladeiras,,0,,0.00,0.00,
assistência técnica electrolux geladeira abertos agora,,0,,0.00,0.00,
assistência técnica electrolux geladeira bertioga sp,,0,,0.00,0.00,
assistência técnica electrolux geladeira bh,,0,,0.00,0.00,
assistência técnica electrolux geladeira campinas,,0,,0.00,0.00,
assistência técnica electrolux geladeira frost free df 42,,0,,0.00,0.00,
assistência técnica electrolux geladeira ipatinga,,0,,0.00,0.00,
assistência técnica electrolux geladeira patobranco,,0,,0.00,0.00,
assistência técnica electrolux geladeira recife,,0,,0.00,0.00,
assistência técnica electrolux geladeira rio de janeiro,,0,,0.00,0.00,
assistência técnica electrolux geladeira rj,,0,,0.00,0.00,
assistência técnica electrolux geladeira santa cruz do sul,,0,,0.00,0.00,
assistência técnica electrolux geladeiras em campo grande no rj,,0,,0.00,0.00,
assistência técnica electrolux geladeiras no rio de janeiro,,0,,0.00,0.00,
assistência técnica electrolux para geladeira,,0,,0.00,0.00,
assistência técnica electrolux vc geladeira guarulhos,,0,,0.00,0.00,
assistência técnica eletrolux geladeira,,0,,0.00,0.00,
assistência técnica eletrolux macaé geladeira lavadora de roupas,,0,,0.00,0.00,
assistência técnica eletrolux o preço do automático da geladeira,,0,,0.00,0.00,
assistência técnica em franca de geladeiras,,0,,0.00,0.00,
assistência técnica em geladeira ar e maquina,,0,,0.00,0.00,
assistência técnica em geladeira bairro sao paulo em bh,,0,,0.00,0.00,
assistência técnica em geladeira calcada,,0,,0.00,0.00,
assistência técnica em geladeira consul colocar gás,,0,,0.00,0.00,
assistência técnica em geladeira da electrolux em ibirité,,0,,0.00,0.00,
assistência técnica em geladeira e máquina de lavar,,0,,0.00,0.00,
assistência técnica em geladeira electrolux em poá sp,,0,,0.00,0.00,
assistência técnica em geladeira electrolux em sao jose dorio.preto,,0,,0.00,0.00,
assistência técnica em geladeira electrolux em sorocaba próximo avenida itavuvu,,0,,0.00,0.00,
assistência técnica em geladeira electrolux pirituba,,0,,0.00,0.00,
assistência técnica em geladeira em belo horizonte,,0,,0.00,0.00,
assistência técnica em geladeira em espírito santo do pinhal,,0,,0.00,0.00,
assistência técnica em geladeira em florianópolis sc,,0,,0.00,0.00,
assistência técnica em geladeira em foz do iguaçu,,0,,0.00,0.00,
assistência técnica em geladeira em ipatinga,,0,,0.00,0.00,
assistência técnica em geladeira em olinda ira,,0,,0.00,0.00,
assistência técnica em geladeira em pau amarelo,,0,,0.00,0.00,
assistência técnica em geladeira em ribeirão preto,,0,,0.00,0.00,
assistência técnica em geladeira em salesópolis,,0,,0.00,0.00,
assistência técnica em geladeira em salva,,0,,0.00,0.00,
assistência técnica em geladeira em são joão del rei,,0,,0.00,0.00,
assistência técnica em geladeira em ubá minas gerais,,0,,0.00,0.00,
assistência técnica em geladeira em urupes,,0,,0.00,0.00,
assistência técnica em geladeira garavelo,,0,,0.00,0.00,
assistência técnica em geladeira hd nos estados unidos,,0,,0.00,0.00,
assistência técnica em geladeira juazeiro bahia,,0,,0.00,0.00,
assistência técnica em geladeira na gávea,,0,,0.00,0.00,
assistência técnica em geladeira no boqueirão praia grande,,0,,0.00,0.00,
assistência técnica em geladeira perto de mim,,0,,0.00,0.00,
assistência técnica em geladeira ponta grossa,,0,,0.00,0.00,
assistência técnica em geladeira refrigerador em canoas,,0,,0.00,0.00,
assistência técnica em geladeira região nova campos elíseos,,0,,0.00,0.00,
assistência técnica em geladeira rua fagundes varela jd tupã,,0,,0.00,0.00,
assistência técnica em geladeira salvador,,0,,0.00,0.00,
assistência técnica em geladeiras av abílio machado,,0,,0.00,0.00,
assistência técnica em geladeiras electrolux em gravataí,,0,,0.00,0.00,
assistência técnica em geladeiras eletrolux,,0,,0.00,0.00,
assistência técnica em geladeiras em abílio machado bh,,0,,0.00,0.00,
assistência técnica em geladeiras em itanhaem,,0,,0.00,0.00,
assistência técnica em geladeiras em ituiutaba,,0,,0.00,0.00,
assistência técnica em geladeiras em são carlos,,0,,0.00,0.00,
assistência técnica em geladeiras lavadoras de roupas freezer fogões,,0,,0.00,0.00,
assistência técnica em geladeiras na região do riacho,,0,,0.00,0.00,
assistência técnica em geladeiras na rio verde aparecida de goiânia,,0,,0.00,0.00,
assistência técnica em geladeiras nova service,,0,,0.00,0.00,
assistência técnica em geladeiras palmas to,,0,,0.00,0.00,
assistência técnica em geladeiras são paulo,,0,,0.00,0.00,
assistência técnica em geladeiras zn,,0,,0.00,0.00,
assistência técnica em geladeiras zona norte,,0,,0.00,0.00,
assistência técnica em máquinas de lavar e geladeiras,,0,,0.00,0.00,
assistência técnica em torres geladeira,,0,,0.00,0.00,
assistência técnica emergencial geladeiras,,0,,0.00,0.00,
assistência técnica fogões e geladeira cachoeirinha rs,,0,,0.00,0.00,
assistência técnica freezers e geladeiras,,0,,0.00,0.00,
assistência técnica ge geladeira,,0,,0.00,0.86,
assistência técnica ge geladeira em curitiba,,0,,0.00,0.00,
assistência técnica ge geladeira em guaruja,,0,,0.00,0.00,
assistência técnica ge geladeira recife,,0,,0.00,0.00,
assistência técnica ge geladeira zona leste,,0,,0.00,0.00,
assistência técnica geladeira 24 horas vila velha es,,0,,0.00,0.00,
assistência técnica geladeira 24 horasdivinópolis mg,,0,,0.00,0.00,
assistência técnica geladeira 24horas,,0,,0.00,0.00,
assistência técnica geladeira alfenas,,0,,0.00,0.00,
assistência técnica geladeira alvinópolis atibaia,,0,,0.00,0.00,
assistência técnica geladeira apucarana,,0,,0.00,0.00,
assistência técnica geladeira aracaju,,0,,0.00,0.00,
assistência técnica geladeira atendimento a domicílio em salvador,,0,,0.00,0.00,
assistência técnica geladeira autorizada ferraz de vasconcelos,,0,,0.00,0.00,
assistência técnica geladeira auxiliadora,,0,,0.00,0.00,
assistência técnica geladeira av interlagos,,0,,0.00,0.00,
assistência técnica geladeira av satélite,,0,,0.00,0.00,
assistência técnica geladeira avenida higienópolis santo andré,,0,,0.00,0.00,
assistência técnica geladeira bairro assunção,,0,,0.00,0.00,
assistência técnica geladeira bairro lindéia,,0,,0.00,0.00,
assistência técnica geladeira bairro lindéial,,0,,0.00,0.00,
assistência técnica geladeira bairro santa mônica bh,,0,,0.00,0.00,
assistência técnica geladeira barbacena,,0,,0.00,0.00,
assistência técnica geladeira barueri,,0,,0.00,0.00,
assistência técnica geladeira bauru nossa senhora de fátima,,0,,0.00,0.00,
assistência técnica geladeira benedito bentes,,0,,0.00,0.00,
assistência técnica geladeira bh,,0,,2.21,0.94,
assistência técnica geladeira boqueirão curitiba,,0,,0.00,0.00,
assistência técnica geladeira bosch belém pará,,0,,0.00,0.00,
assistência técnica geladeira bosch bh,,0,,0.00,0.00,
assistência técnica geladeira bosch campinas,,0,,0.00,0.00,
assistência técnica geladeira bosch campinas sp,,0,,0.00,0.00,
assistência técnica geladeira bosch campinash,,0,,0.00,0.00,
assistência técnica geladeira bosch canoas,,0,,0.00,0.00,
assistência técnica geladeira bosch curitiba,,0,,0.00,0.00,
assistência técnica geladeira bosch df,,0,,0.00,0.00,
assistência técnica geladeira bosch em itapira,,0,,0.00,0.00,
assistência técnica geladeira bosch em mogi das cruzes,,0,,0.00,0.00,
assistência técnica geladeira bosch em porto alegre,,0,,0.00,0.00,
assistência técnica geladeira bosch em sao paulo,,0,,0.00,0.00,
assistência técnica geladeira bosch em são bernardo do campo,,0,,0.00,0.00,
assistência técnica geladeira bosch frost free 44,,0,,0.00,0.00,
assistência técnica geladeira bosch guarulhos,,0,,0.00,0.00,
assistência técnica geladeira bosch maricá,,0,,0.00,0.00,
assistência técnica geladeira bosch mogi guacu,,0,,0.00,0.00,
assistência técnica geladeira bosch nao esta gelando,,0,,0.00,0.00,
assistência técnica geladeira bosch porto alegre,,0,,0.00,0.00,
assistência técnica geladeira bosch sorocaba,,0,,0.00,0.00,
assistência técnica geladeira bosch são joão del rei,,0,,0.00,0.00,
assistência técnica geladeira bosch são leopoldo,,0,,0.00,0.00,
assistência técnica geladeira bosh sorocaba,,0,,0.00,0.00,
assistência técnica geladeira brastemp alfenas,,0,,0.00,0.00,
assistência técnica geladeira brastemp alphaville,,0,,0.00,0.00,
assistência técnica geladeira brastemp apucarana,,0,,0.00,0.00,
assistência técnica geladeira brastemp araraquara,,0,,0.00,0.00,
assistência técnica geladeira brastemp ative,,0,,0.00,0.00,
assistência técnica geladeira brastemp campinas,,0,,0.00,0.00,
assistência técnica geladeira brastemp consul electrolux canoas canoas rs,,0,,0.00,0.00,
assistência técnica geladeira brastemp curitiba,,0,,0.00,0.00,
assistência técnica geladeira brastemp divinópolis mg,,0,,0.00,0.00,
assistência técnica geladeira brastemp edem sorocaba,,0,,0.00,0.00,
assistência técnica geladeira brastemp em bragança paulçista,,0,,0.00,0.00,
assistência técnica geladeira brastemp em carapicuíba,,0,,0.00,0.00,
assistência técnica geladeira brastemp em colatina,,0,,0.00,0.00,
assistência técnica geladeira brastemp em florianópolis,,0,,0.00,0.00,
assistência técnica geladeira brastemp em piracicaba,,0,,0.00,0.00,
assistência técnica geladeira brastemp em salvador,,0,,0.00,0.00,
assistência técnica geladeira brastemp em sao luis,,0,,0.00,0.00,
assistência técnica geladeira brastemp em são josé do rio preto-sp,,0,,0.00,0.00,
assistência técnica geladeira brastemp em são josé dos campos,,0,,0.00,0.00,
assistência técnica geladeira brastemp fortaleza,,0,,0.00,0.00,
assistência técnica geladeira brastemp g,,0,,0.00,0.00,
assistência técnica geladeira brastemp guarulhos,,0,,0.00,0.00,
assistência técnica geladeira brastemp inverse,,0,,0.00,0.00,
assistência técnica geladeira brastemp macapá ap,,0,,0.00,0.00,
assistência técnica geladeira brastemp natal,,0,,0.00,0.00,
assistência técnica geladeira brastemp natal rn,,0,,0.00,0.00,
assistência técnica geladeira brastemp nova limap,,0,,0.00,0.00,
assistência técnica geladeira brastemp piracicaba,,0,,0.00,0.00,
assistência técnica geladeira brastemp rio de janeiro rj,,0,,0.00,0.00,
assistência técnica geladeira brastemp salvador,,0,,0.00,0.00,
assistência técnica geladeira brastemp side inverse em cruzeiro sp,,0,,0.00,0.00,
assistência técnica geladeira brastemp sjc,,0,,0.00,0.00,
assistência técnica geladeira brastemp são josé do rio preto sp,,0,,0.00,0.00,
assistência técnica geladeira brastemp tijuca rio de janeiro rj,,0,,0.00,0.00,
assistência técnica geladeira brastemp tramandaí,,0,,0.00,0.00,
assistência técnica geladeira brastemp valinhos,,0,,0.00,0.00,
assistência técnica geladeira brastemp vitória es,,0,,0.00,0.00,
assistência técnica geladeira cce,,0,,0.00,0.00,
assistência técnica geladeira cce em balneário camboriú,,0,,0.00,0.00,
assistência técnica geladeira christiano ottoni,,0,,0.00,0.00,
assistência técnica geladeira cic,,0,,0.00,0.00,
assistência técnica geladeira cidade christiano ottoni,,0,,0.00,0.00,
assistência técnica geladeira cidade líder,,0,,0.00,0.00,
assistência técnica geladeira cidade tiradentes,,0,,0.00,0.00,
assistência técnica geladeira climatizar,,0,,0.00,0.00,
assistência técnica geladeira colombo,,0,,0.00,0.00,
assistência técnica geladeira consul bel ford rj,,0,,0.00,0.00,
assistência técnica geladeira consul bem estar bh,,0,,0.00,0.00,
assistência técnica geladeira consul cidade dutra,,0,,0.00,0.00,
assistência técnica geladeira consul em santo andré,,0,,0.00,0.00,
assistência técnica geladeira consul em sobradinho,,0,,0.00,0.00,
assistência técnica geladeira consul em vilhena ro,,0,,0.00,0.00,
assistência técnica geladeira consul interlagos,,0,,0.00,0.00,
assistência técnica geladeira consul maceió,,0,,0.00,0.00,
assistência técnica geladeira consul manaus,,0,,0.00,0.00,
assistência técnica geladeira consul moema,,0,,0.00,0.00,
assistência técnica geladeira consul niterói,,0,,0.00,0.00,
assistência técnica geladeira consul perto de mim,,0,,0.48,0.94,
assistência técnica geladeira consul porto alegre,,0,,0.00,0.00,
assistência técnica geladeira consul rj,,0,,0.00,0.00,
assistência técnica geladeira consul salvador,,0,,0.22,0.79,
assistência técnica geladeira consul santa efigenia,,0,,0.00,0.00,
assistência técnica geladeira consul santarem,,0,,0.00,0.00,
assistência técnica geladeira consul tramandaí,,0,,0.00,0.00,
assistência técnica geladeira consul zona sul rj,,0,,0.00,0.00,
assistência técnica geladeira continental belém pará,,0,,0.00,0.00,
assistência técnica geladeira continental bh,,0,,0.00,0.00,
assistência técnica geladeira continental campo grande ms,,0,,0.00,0.00,
assistência técnica geladeira continental ceará mirim,,0,,0.00,0.00,
assistência técnica geladeira continental copacabana,,0,,0.00,0.00,
assistência técnica geladeira continental curitiba,,0,,0.00,0.00,
assistência técnica geladeira continental em brasília,,0,,0.00,0.00,
assistência técnica geladeira continental em fazenda rio grande,,0,,0.00,0.00,
assistência técnica geladeira continental em lins,,0,,0.00,0.00,
assistência técnica geladeira continental em sertãozinho,,0,,0.00,0.00,
assistência técnica geladeira continental em sorocaba,,0,,0.00,0.00,
assistência técnica geladeira continental jacarei,,0,,0.00,0.00,
assistência técnica geladeira continental litoral norte de sp,,0,,0.00,0.00,
assistência técnica geladeira continental ribeirão preto,,0,,0.00,0.00,
assistência técnica geladeira continental salvador,,0,,0.00,0.00,
assistência técnica geladeira continental santo andré,,0,,0.00,0.00,
assistência técnica geladeira continental santo andré 24 horas,,0,,0.00,0.00,
assistência técnica geladeira continental são cristóvão,,0,,0.00,0.00,
assistência técnica geladeira continental venda nova,,0,,0.00,0.00,
assistência técnica geladeira continental venda nova bh,,0,,0.00,0.00,
assistência técnica geladeira cristiano otoni,,0,,0.00,0.00,
assistência técnica geladeira cruzeiro sp,,0,,0.00,0.00,
assistência técnica geladeira cônsul bh,,0,,0.00,0.00,
assistência técnica geladeira cônsul em ponta grossa,,0,,0.00,0.00,
assistência técnica geladeira cônsul em uberlândia,,0,,0.00,0.00,
assistência técnica geladeira cônsul recife,,0,,0.00,0.00,
assistência técnica geladeira dako,,0,,0.91,0.52,
assistência técnica geladeira dako duo 360,,0,,0.00,0.00,
assistência técnica geladeira dako em ferraz de vasconcelos,,0,,0.00,0.00,
