Keyword,Intent,Volume,Keyword Difficulty,CPC (USD),Competitive Density,SERP Features
conserto de geladeira de caminhão,Informational,90,31,0.28,0.19,"AI Overview, Image pack, Video, Knowledge panel, Related searches"
como consertar condensador furado geladeira caminhão,,0,,0.00,0.00,
como consertar unidade eletronica de geladeira de caminhão 12 24,,0,,0.00,0.00,
conserto compressor geladeira de caminhão elber,,0,,0.00,0.00,
conserto de geladeira de caminhão campo grande es,,0,,0.00,0.00,
conserto de geladeira de caminhão em curitiba,,0,,0.00,0.00,
conserto de geladeira de caminhão em foz do iguaçu,,0,,0.00,0.00,
conserto de geladeira de caminhão farroupilha,,0,,0.00,0.00,
conserto de geladeira passo fundo caminhão,,0,,0.00,0.00,
conserto geladeira de caminhão,,0,,0.00,0.00,
conserto geladeira de caminhão foz do iguacu,,0,,0.00,0.00,
geladeira caminhão conserto,,0,,0.00,0.00,
geladeira de caminhão conserto mato grosso do sul,,0,,0.00,0.00,
onde consertar geladeira de caminhão,,0,,0.00,0.00,
